source,author,title,description,url,urlToImage,publishedAt,content
"{'id': 'business-insider', 'name': 'Business Insider'}",insider@insider.com (Meghan Morris),Apple cut more than 600 California employees after retreating from its car and screen projects,Tech giant Apple downsizes workforce tied to two major projects.,https://www.businessinsider.com/apple-cuts-600-california-jobs-after-electric-vehicle-screen-retreats-2024-4,https://i.insider.com/65bcdd0543bb77284ba2e94c?width=1200&format=jpeg,2024-04-05 02:14:44+00:00,"Apple has cut more than 600 employees in California as it pulls back from two major projects.

The layoffs follow struggles with cost overruns and delays in Apple's electric-car and screen projects.

Some employees have moved to the company's growing artificial-intelligence division.

NEW LOOK Sign up to get the inside scoop on today’s biggest stories in markets, tech, and business — delivered daily. Read preview Thanks for signing up! Access your favorite topics in a personalized feed while you're on the go. download the app Email address Sign up By clicking “Sign Up”, you accept our Terms of Service and Privacy Policy . You can opt-out at any time.

Advertisement

As Apple retreats from two ambitious projects, the tech giant has cut more than 600 employees in California, according to filings with the state.

On Tuesday, Apple filed a series of notices with the state about layoffs effective in late May for various Santa Clara offices. Bloomberg reported that one of the addresses was home to a display-development office, while the others were for the company's electric-car effort.

This story is available exclusively to Business Insider subscribers. Become an Insider and start reading now. Have an account? Log in ."
"{'id': 'fortune', 'name': 'Fortune'}","Rachel Graf, Bloomberg",Family of Apple engineer killed in EV crash say former employer is ‘secretly’ supporting Tesla’s attempt to blame distracted driver for gaming at the wheel,"Based on forensic examinations of Walter Huang’s iPhone, Tesla has said he was playing Sega’s Total War: Three Kingdoms at the time of the crash.",https://fortune.com/2024/04/05/apple-engineer-walter-huang-killed-crash-employer-supporting-tesla-attempt-blame-distracted-driver-gaming/,"https://fortune.com/img-assets/wp-content/uploads/2024/04/GettyImages-1247204407-e1712311530790.jpg?resize=1200,600",2024-04-05 10:07:39+00:00,"Tesla Inc. is relying on technical support from Apple Inc. as the car company seeks to prove at an upcoming high-profile trial over the safety of its Autopilot system that a Model X driver who worked for the iPhone maker was playing a video game on his phone when he crashed and died.

Lawyers for the family of Walter Huang, an engineer who was killed on his commute to work, say his former employer is “secretly” maneuvering to support Tesla’s attempt to blame distracted driving for the wreck. A National Transportation Safety Board investigation had failed to reach a definitive conclusion about what Huang was doing in the final seconds before impact.

Based on forensic examinations of Huang’s iPhone, Tesla has said he was playing Sega’s Total War: Three Kingdoms at the time of the crash, though the Huang family’s attorneys say Tesla can’t prove that just because the app was open on his screen.

The two sides are sparring over whether Tesla can call an Apple engineering manager as a witness for a two-month trial set to start next week in state court in San Jose. Apple representatives didn’t respond to a request for comment after regular business hours.

Tesla has prevailed in two previous California trials over Autopilot — the second one involving a fatal crash — in which the driver-assistance system was blamed after the vehicles veered off the road.

The company voluntarily recalled 2 million vehicles late last year after the National Highway Traffic Safety Administration found that Autopilot failed to ensure drivers stay attentive. Lawyers representing crash victims and family members who have sued Tesla over accidents say the determination bolsters their claims that the technology is defective and contributed to collisions.

Tesla obtained a sworn statement from an Apple engineering manager, James Harding, who analyzed unencrypted telemetry data on Huang’s phone and said it “suggests possible user interaction, which might be a screen touch or button press.”

The Huang family’s lawyers have countered in a court filing that Tesla purposefully hid its questioning of Harding from them until after pretrial fact-finding deadlines. They are now trying to force Apple to provide more information, and the iPhone maker is pushing back, saying that it shouldn’t have to hand over confidential material.

The NTSB said in a report that the probable cause of Huang’s crash into a barrier along Highway 101 in Mountain View was a combination of “limitations” with the Autopilot system and the driver’s “lack of response due to distraction likely from a cell phone game application and overreliance” on Autopilot.

The report noted that the Model X’s computer detected that Huang’s hands weren’t on the steering wheel just before the crash. Tesla’s owner’s manual says Autopilot users must remain engaged while driving.

The agency also faulted California’s highway department for failing to fix the barrier that Huang’s car collided with after it was damaged in a previous crash.

The case is Huang v. Tesla Inc., 19CV346663, California Superior Court, Santa Clara County (San Jose)."
"{'id': 'business-insider', 'name': 'Business Insider'}",Theron Mohamed,Wall Street seems worried about Apple — and divided over its stock,"Some analysts think Apple is falling behind its peers, while others see the iPhone maker as an exceptional company navigating some headwinds.",https://www.businessinsider.com/apple-stock-price-layoffs-ai-china-headwinds-outlook-big-tech-2024-4,https://i.insider.com/660fd4491caec1275a6d2859?width=1200&format=jpeg,2024-04-05 11:49:28+00:00,"Apple is cutting more than 600 staff after reportedly shelving two projects.

The iPhone maker risks losing focus and falling behind its rivals in the AI race, analysts say.

Apple stock has slid 12% this year as concerns about growth and regulation mount.

NEW LOOK Sign up to get the inside scoop on today’s biggest stories in markets, tech, and business — delivered daily. Read preview Thanks for signing up! Access your favorite topics in a personalized feed while you're on the go. download the app Email address Sign up By clicking “Sign Up”, you accept our Terms of Service and Privacy Policy . You can opt-out at any time.

Advertisement

Apple's decision to cut more than 600 employees in California speaks to the challenges facing the technology titan and affecting its stock price — and why analysts are divided over its outlook.

The iPhone maker is laying off or reassigning the workers as it reportedly pulls back from its electric vehicle and next-generation Apple Watch display projects.

At the same time, reports suggest Apple is looking into building robots that help people with household tasks. But some analysts have warned the initiative may be a costly distraction and might not bear fruit this decade.

""I put the probability that we see a product in the next 5 years at slim to none,"" Gene Munster, the managing partner at Deepwater Asset Management, posted on X. ""As a reminder Apple works on a lot of things that never see the light of day.""

Advertisement

Wedbush tech analyst Dan Ives struck a harsher tone in a CNBC interview this week.

""It would be a horror show if they actually spent money on robots,"" he said. ""They need to focus on AI. For Cook, his legacy is going to be AI. If they went after robots, that would be a black eye moment for Apple.""

Souring on the stock

Apple's reported dismantling of two projects and teams, and its pivot toward personal robotic helpers, will only fuel concerns that the company has lost focus and fallen behind its Big Tech peers in critical areas like AI.

Related stories

Worries that Apple has lost its way have weighed on its stock price. The shares have slumped 12% from their closing price at the end of 2023, cutting the company's value by more than $300 billion.

Advertisement

In contrast, the S&P 500 has climbed nearly 8% this year, and arch rival and OpenAI investor Microsoft has advanced about 11%.

Microsoft is now worth about half a trillion dollars more than Apple at $3.1 trillion.

Other pressures on the stock include concerns about overvaluation, flagging growth, rising tensions and slowing sales in China, high-profile clashes with regulators in the US and Europe, and less defensive cachet among investors as recession fears fade.

Even so, Apple is a mainstay of many stock portfolios and unlikely to fall much further, Craig Johnson, chief market technician at Piper Sandler, told Bloomberg.

Advertisement

""Nobody wants to sell any more of their Apple positions because there's a dividend, big share buybacks, and no one wants to pay capital-gains taxes on it,"" he said.

Warren Buffett, whose Berkshire Hathaway conglomerate owns almost 6% of Apple, has hailed it as a ""family jewel"" and ""probably the best business"" he knows. The legendary investor has also praised the company's buybacks as they've gradually raised Berkshire's ownership stake without it spending a penny.

'Attractive place'

Johnson echoed Buffett's views in a Yahoo Finance interview. He praised Apple's financial strength, solid profit margins, buybacks, and business model that drives repeat purchases. He also pitched it as a haven if stocks tumble.

""With a market that looks like it's setting itself up for a good 5 to 10% correction, Apple looks like a pretty attractive place for people to park their money,"" he said.

Advertisement

Apple stock may be under the cosh and the company might be a little lost, but analysts continue to see a world-class business navigating a tough period instead of a lost cause."
"{'id': 'financial-post', 'name': 'Financial Post'}",The Associated Press,Apple lays off more than 600 workers in California in its first major round of post-pandemic cuts,"Apple is laying off more than 600 workers in California, marking the company’s first big wave of post-pandemic job cuts amid a broader wave of tech industry consolidation. The iPhone maker notified 614 workers in multiple offices on March 28 that they were lo…",https://financialpost.com/pmn/business-pmn/apple-lays-off-more-than-600-workers-in-california-in-its-first-major-round-of-post-pandemic-cuts,https://smartcdn.gprod.postmedia.digital/financialpost/wp-content/uploads/2024/04/tok301-the-associated-press.jpg,2024-04-05 11:49:47+00:00,"Apple lays off more than 600 workers in California in its first major round of post-pandemic cuts

The iPhone maker notified 614 workers in multiple offices on March 28 that they were losing their jobs, with the layoffs becoming effective on May 27, according to reports to regional authorities.

Apple lays off more than 600 workers in California in its first major round of post-pandemic cuts

We apologize, but this video has failed to load.

Apple is laying off more than 600 workers in California, marking the company’s first big wave of post-pandemic job cuts amid a broader wave of tech industry consolidation.

This advertisement has not loaded yet, but your article continues below.

Create an account or sign in to continue with your reading experience.

Subscribe now to read the latest news in your city and across Canada.

Subscribe now to read the latest news in your city and across Canada.

Article content

The workers were cut from eight offices in Santa Clara, according to the filings under the state’s Worker Adjustment and Retraining Notification Act, also known as WARN. But it’s not clear which departments or projects the employees were involved in.

Apple did not immediately respond to a request for comment early Friday.

The Cupertino, California, company had been a notable exception as other tech companies slashed their workforces over the past two years. There was a massive surge in hiring during the COVID-19 pandemic, when people spent more time and money online, and big tech companies are still larger than they were before the pandemic. Still, as growth slows, companies are focusing on cutting costs.

In a recent regulatory filing, Apple said it had about 161,000 full-time equivalent employees.

Amazon announced earlier this week a fresh round of layoffs, this time at its cloud computing business AWS. In recent months, video game maker Electronic Arts said it’s cutting about 5% of its workforce, Sony said its axing about 900 jobs in its PlayStation division, Cisco Systems revealed plans to lay off more than 4,000 workers and social media company Snap, owner of Snapchat, announced its slashing 10% of its global workforce."
"{'id': 'business-insider', 'name': 'Business Insider'}",Hasan Chowdhury,Apple layoffs are a sign Tim Cook is getting a little more serious,The iPhone maker has laid off some 600 employees in California working on expensive R&D projects at a time when its core products face fresh pressure.,https://www.businessinsider.com/apple-layoffs-tim-cook-getting-serious-challenges-car-china-iphone-2024-4,https://i.insider.com/660fe78116bde8d4ead5fb65?width=1200&format=jpeg,2024-04-05 12:27:33+00:00,"Things are getting a bit more serious this year over at Apple.

The company is laying off some 600 people who worked on expensive R&D projects.

It comes as Apple faces several challenges that threaten its dominance.

NEW LOOK Sign up to get the inside scoop on today’s biggest stories in markets, tech, and business — delivered daily. Read preview Thanks for signing up! Access your favorite topics in a personalized feed while you're on the go. download the app Email address Sign up By clicking “Sign Up”, you accept our Terms of Service and Privacy Policy . You can opt-out at any time.

Advertisement

Things have been getting a little more serious over in Cupertino this year for Tim Cook.

The latest sign of the mood change came Thursday after it emerged that Apple had laid off over 600 employees in California. The news came from filings with the California Employment Development Department first reported by Bloomberg.

In a year when the tech industry has already cut almost 60,000 employees — with Apple's Big Tech peers slashing a considerable number more from their workforces since they began layoffs in 2023 — that might not seem like a big deal. That's especially so when considering that Apple had about 161,000 full-time employees at the end of its last fiscal year.

That said, the move to let go of employees at a firm that rarely makes cuts has significance.

Advertisement

Affected employees included those involved in expensive research-and-development projects, such as Apple's secretive electric-vehicle work, which was scrapped in February and had cost $1 billion a year since 2014, and a complex in-house project to make brighter smartwatch screens with microLED technology.

In other words, layoffs of employees on these projects — which were reported to have been shut down at the same time and had no immediate end in sight — signal that Apple's CEO is making the company more focused.

There's no shortage of reasons for doing so.

Related stories

Cook's stewardship of Apple faces perhaps its biggest challenge since he took over as CEO in 2011. The company's stock was down by over 10% at the end of March compared with the start of the year as it faced challenges on several fronts demanding its full attention.

Advertisement

One of its biggest headaches involves the product that has been its reliable workhorse over the years: the iPhone.

Since the beginning of the year, the smartphone has faced sales pressure in China, in particular — Apple's most important international market — with rival offerings such as Huawei's 5G-enabled Mate 60 Pro earning favor among consumers over the latest generation of iPhones.

Apple's iPhone 15 family of devices. Apple

Data published in March by Counterpoint Research, for example, shows that iPhone sales fell 24% in the first six weeks of 2024, while overall shipments in February were 33% lower than in the same month a year ago, per Bloomberg.

Though Apple's AI announcements coming late this year could reveal new features that make iPhones seem more attractive again, Apple's secrecy over what it has been working on makes it difficult to know how its efforts on the technology of the moment compare to its rivals.

Advertisement

The company has also committed to the unproven sector of mixed reality, following the February release of its $3,500 Vision Pro headset. Though Cook has touted it as an immersive vision of computing that gives users an ""infinite canvas,"" consumer interest has been slow to emerge.

Apple's Vision Pro. Michael M. Santiago/Getty Images

As my colleague Peter Kafka has noted, influential analysts like Ben Thompson have started to say the Vision Pro lacks sales-driving apps. Meanwhile, the likes of Mark Zuckerberg have been happily publishing critical teardowns.

Product issues aren't the only burden Apple faces, with the company facing legal battles of an immense scale in both the US and the European Union.

Last month, the Justice Department sued Apple, claiming that it had monopolized the smartphone market. In the EU, Apple has been facing regulators asking it to comply with the sweeping new rules of the Digital Markets Act, which aims to crack open its App Store.

Advertisement

These are challenges that Cook cannot afford to take lightly."
"{'id': 'business-insider', 'name': 'Business Insider'}",Jennifer Sor,"Apple focusing on home robots over AI would be a 'horror show' for the company, Wedbush's Dan Ives says","""If they went after robots, that would be a black eye moment for Apple,"" Wedbush analyst Dan Ives said.",https://www.businessinsider.com/apple-home-robot-appl-stock-outlook-ai-wedbush-dan-ives-2024-4,https://i.insider.com/60a2d7511b5cea0019c45670?width=1200&format=jpeg,2024-04-05 15:38:08+00:00,"By clicking “Sign Up”, you accept our Terms of Service and Privacy Policy . You can opt-out at any time.

Access your favorite topics in a personalized feed while you're on the go. download the app

Sign up to get the inside scoop on today’s biggest stories in markets, tech, and business — delivered daily. Read preview

Apple's recently announced foray into developing home robots could end up being a ""horror show"" for the company, according to Wedbush analyst Dan Ives.

Speaking to CNBC this week, Ives referenced a Bloomberg report that Apple is exploring the creation of home robots, with an eye on that becoming the tech giant's ""next big thing."" The news came not long after the iPhone-maker dashed plans to roll out a self-driving car, a decade-long project known as Project Titan.

This story is available exclusively to Business Insider subscribers. Become an Insider and start reading now.

Ives thinks such a shift would be detrimental to Apple, which should instead be primarily focused on leaning into artificial intelligence.

Related stories

""It would be a horror if they actually spent money on robots. Look at the failed EV initiative, Project Titan,"" Ives said. ""For Cook, his legacy is going to be AI. If they went after robots, that would be a black eye moment for Apple.""

Advertisement

Other strategists on Wall Street have also sounded doubts over Apple's robot development. Gene Munster, who has been bullish on the iPhone maker for years, noted that the company has shelved plenty of projects over the years before ever rolling them out to the public.

""I 100% agree it makes sense for Apple to have a small skunkworks project exploring a deeper dive into home automation. That said, I put the probability that we see a product in the next five years at slim to none,"" Munster said in a post on X.

Apple has faced a number of negative headwinds and headlines over the last year, stemming from restrictions in China, an anti-trust lawsuit from the Department of Justice, and recent layoffs. Shares of its stock have slid 12% from levels at the start of 2024.

Even amid his concern around Apple's home robots, Ives remains bullish on the company's stock trajectory over the medium-term. In Wedbush's latest note on Apple, the firm maintained its ""outperform"" rating on the stock and 12-month price target of $250, implying shares will rise 47%. But that projection hinges on Apple continuing to put its AI at the forefront of its priorities, the analysts suggested.

Advertisement

""We have seen Apple's back against the wall before and we view this period as just another chapter in the Apple growth story with AI now on the doorstep of coming to Cupertino,"" the note said."
"{'id': 'business-insider', 'name': 'Business Insider'}",Lloyd Lee,Tesla is trying to get an Apple engineer to testify in its defense at its fatal Autopilot crash trial,Tesla plans to call an Apple engineer as a witness to prove that Walter Huang was playing video games on his phone before his fatal accident.,https://www.businessinsider.com/tesla-apple-autopilot-crash-wrongful-death-lawsuit-playing-video-games-2024-4,https://i.insider.com/660f50851caec1275a6d2060?width=1200&format=jpeg,2024-04-05 16:03:14+00:00,"By clicking “Sign Up”, you accept our Terms of Service and Privacy Policy . You can opt-out at any time.

Access your favorite topics in a personalized feed while you're on the go. download the app

Sign up to get the inside scoop on today’s biggest stories in markets, tech, and business — delivered daily. Read preview

Tesla is set to go to trial next week over a lawsuit brought against it in 2019 over the role its Autopilot feature played in the fatal crash of Wei ""Walter"" Huang, an Apple engineer.

And now, in the 11th hour, Tesla hopes to involve Apple itself in the case by calling an engineer as a witness in an attempt to prove Huang was at fault for the collision.

This story is available exclusively to Business Insider subscribers. Become an Insider and start reading now.

Tesla plans to introduce a sworn statement from the Apple employee to argue that Huang, who died in 2018 after his Model X crashed into a safety barrier while the vehicle was on Autopilot, was distracted while playing a game on his iPhone, according to court documents viewed by Business Insider.

The family of Huang filed a wrongful-death lawsuit against Tesla in 2019, accusing the automaker's Autopilot feature of being ""defective in its design."" The family argued that because of what it said were faults of the feature, Tesla was responsible for Huang's death.

Advertisement

The company told BI in 2018 that the only explanation for the crash was Huang's inattentiveness, an argument that the carmaker continues to rely on as it faces legal battles regarding its Autopilot function.

Tesla did not respond to a request for comment.

An investigation by the National Transportation Safety Board previously found that while there was no singular cause for the crash, Tesla's Autopilot had ""system limitations,"" adding that Huang had a game open on his phone, with him putting too much faith in the Autopilot function before the crash.

Related stories

However, investigators were unable to determine whether Huang was actively playing the game before the collision, according to the NTSB report. Huang's family argues that he was letting the game run passively on his phone.

Advertisement

Now, with the case set to go to trial on Monday, Tesla introduced a sworn statement from an Apple employee. It's also seeking to call the Apple employee as a witness in the trial, but attorneys for Huang's family are pushing back.

The written statement from the Apple engineer James Harding claims that data extracted from Huang's iPhone 8 showed he was actively on his phone at the time of the crash.

Attorneys representing the Huang family accused Apple in recently filed court documents of ""engaging in a secret discovery 'work around' to help support Tesla in its defense.""

The Huang family's attorneys said Tesla revealed the first sworn statement signed by Harding five months after the discovery process ended and then produced the second sworn statement only three days before trial.

Advertisement

An Apple spokesperson and an attorney for the Huang family declined to comment.

Following Harding's more recent sworn statement, attorneys for the Huang family subpoenaed Apple to acquire more information about Harding's testimony. However, Apple argued that the attorneys were asking for a ""substantial volume"" of ""privileged"" material.

Apple said in an application to quash the subpoena that it was ""not a party to this case, has never appeared, and has not received any notice of entry of order relating to the dispute.""

""While Apple is ready to work in good faith with the Parties and to fulfill its obligations as a non-party witness, it is very unclear on its present obligations and seeks guidance from the Court,"" the filing said.

Advertisement

By attempting to quash the subpoena by the plaintiffs and seeking a protective order, Apple is trying to prevent attorneys from questioning Harding before the trial, the Huang family said in a March 29 court filing.

Tesla faces several lawsuits concerning its Autopilot function."
