source,author,title,description,url,urlToImage,publishedAt,content
"{'id': 'cnn', 'name': 'CNN'}","Anna Cooban, CNN",‘Perfect landing spot.’ Apple plans to spend more in Vietnam as it looks beyond China,"Apple is planning to buy more components from Vietnam, underscoring a trend among global tech firms to look beyond China to secure their supply chains, cut...",https://www.cnn.com/2024/04/18/tech/apple-vietnam-supply-chain-china?cid=external-feeds_iluminar_yahoo,https://media.zenfs.com/en/cnn_business_articles_218/f5a75bd0a2fdbf9fd01fb360e0281038,2024-04-18 15:45:29+00:00,"London CNN —

Apple is planning to buy more components from Vietnam, underscoring a trend among global tech firms to look beyond China to secure their supply chains, cut costs and open up new markets.

CEO Tim Cook made the pledge in a meeting with Vietnamese Prime Minister Pham Minh Chinh in Hanoi Tuesday, according to a statement by Vietnam’s government.

Apple (AAPL) has already spent almost $16 billion through its supply chain in the country since 2019, the government quoted Cook as saying. And the company has created more than 200,000 jobs in Vietnam, it added.

According to the statement, Cook said Apple “stands ready … to enhance cooperation and investment activities” in the Southeast Asian country.

His visit highlights Vietnam’s growing importance to global companies looking for alternatives to China as trade tensions between Beijing and the West have escalated in recent years.

Vietnam has been a “major beneficiary” of moves by multinational companies to diversify their manufacturing hubs — a strategy known as “China plus one” — says Thuy Anh Nguyen, a strategist at Dragon Capital, a local fund management firm that invests solely in Vietnamese companies.

Nguyen, whose firm manages $6 billion in assets, told CNN that labor costs in Vietnam’s manufacturing sector are about half those in neighboring China.

That has helped Vietnam go from producing mostly “low-value products” like textiles to more tech products like iPhones and iPads, she said. “Those are higher-value items. That’s how we move up the value chain.”

Vietnam pulled in more than $4.29 billion in foreign direct investment during the first two months of the year, up almost 39% from the same period in 2023, according to the country’s Ministry of Planning and Investment. Most of the new investment went into the processing and manufacturing sector.

A ‘perfect landing spot’

In recent years, fast-growing Asian economies like Vietnam and India have emerged as alternative locations for manufacturers as ties between Beijing and the West have frayed.

Vietnam is “the perfect landing spot for tech companies to diversify outside China,” according to Dan Ives, a senior equity analyst at Wedbush Securities, who pointed to the high number of trained engineers in the country as one factor.

“We’re not just talking about (manufacturing of) low-cost electronics,” he told CNN. “We’re talking higher up the value chain… That was not even on the radar (of foreign companies) two years ago.”

Once enemies in war, the United States and Vietnam have grown increasingly close — the value of US imports of Vietnamese goods s﻿oared more than 360% in the decade to end-2023 to top $144 billion, according to US government data.

In September, the two countries formally upgraded their diplomatic ties to a “comprehensive strategic partnership,” a symbolic yet highly important move that positions Vietnam as a destination for more US investment, including for critical technologies like semiconductor chips.

Apple CEO Tim Cook at a visit to a school in Hanoi on April 16, 2024. Tuan Hung/VNExpress/AP

Intel (INTC) has also taken note of Vietnam’s rise. In 2021, the company committed $1.5 billion to a sprawling campus just outside Ho Chi Minh City, which it says will be its largest single assembly and test facility in the world.

At the same time, relations between the United States and China have deteriorated. A trade war between the two countries, which began in 2018 when Washington slapped tariffs on many Chinese imports, ratcheted up last year as both sides introduced tit-for-tat chipmaking export controls.

During the pandemic, meanwhile, China’s strict zero-Covid policy scrambled global supply chains, demonstrating the risks of concentrating production in a single location.

Notably, the world’s biggest iPhone factory, located in central China and owned by Taiwanese manufacturing firm Foxconn, was forced to temporarily shut down in 2022 after workers revolted over fears of the spread of coronavirus.

Consumer market

Vietnam has another advantage, says Nguyen: A booming, educated, and youthful population. That’s a big draw for foreign tech companies looking to hire workers for their factories, and find consumers for their products.

“Vietnam has a population of 100 million people. If it was in Europe, it would be the biggest country,” she said, also noting that smartphone adoption in Vietnam was rapidly increasing.

The International Monetary Fund expects Vietnam’s economy to growth 5.8% this year, much faster than the predicted global average of 3.2%. For 2025, the fund forecasts growth of 6.5% in Vietnam. That’s not far off India’s pace of expansion.

Still, Vietnam represents a far smaller market than India, which has also been wooing large foreign companies, including Tesla (TSLA), to set up factories in the country.

For now, Vietnam’s attractiveness to foreign firms is “more around supply than demand,” says Ives at Wedbush Securities, while, for India, it encompasses both.

Juliana Liu contributed reporting."
"{'id': 'cnn', 'name': 'CNN'}",Anna Cooban,Apple plans to spend more in Vietnam as it looks beyond China,"Apple is planning to buy more components from Vietnam, underscoring a trend among global tech firms to look beyond China to secure their supply chains, cut costs and open up new markets.",https://www.cnn.com/2024/04/18/tech/apple-vietnam-supply-chain-china/index.html,"https://media.cnn.com/api/v1/images/stellar/prod/gettyimages-2147845450.jpg?c=16x9&q=w_800,c_fill",2024-04-18 15:50:51+00:00,"London CNN —

Apple is planning to buy more components from Vietnam, underscoring a trend among global tech firms to look beyond China to secure their supply chains, cut costs and open up new markets.

CEO Tim Cook made the pledge in a meeting with Vietnamese Prime Minister Pham Minh Chinh in Hanoi Tuesday, according to a statement by Vietnam’s government.

Apple (AAPL) has already spent almost $16 billion through its supply chain in the country since 2019, the government quoted Cook as saying. And the company has created more than 200,000 jobs in Vietnam, it added.

According to the statement, Cook said Apple “stands ready … to enhance cooperation and investment activities” in the Southeast Asian country.

His visit highlights Vietnam’s growing importance to global companies looking for alternatives to China as trade tensions between Beijing and the West have escalated in recent years.

Vietnam has been a “major beneficiary” of moves by multinational companies to diversify their manufacturing hubs — a strategy known as “China plus one” — says Thuy Anh Nguyen, a strategist at Dragon Capital, a local fund management firm that invests solely in Vietnamese companies.

Nguyen, whose firm manages $6 billion in assets, told CNN that labor costs in Vietnam’s manufacturing sector are about half those in neighboring China.

That has helped Vietnam go from producing mostly “low-value products” like textiles to more tech products like iPhones and iPads, she said. “Those are higher-value items. That’s how we move up the value chain.”

Vietnam pulled in more than $4.29 billion in foreign direct investment during the first two months of the year, up almost 39% from the same period in 2023, according to the country’s Ministry of Planning and Investment. Most of the new investment went into the processing and manufacturing sector.

A ‘perfect landing spot’

In recent years, fast-growing Asian economies like Vietnam and India have emerged as alternative locations for manufacturers as ties between Beijing and the West have frayed.

Vietnam is “the perfect landing spot for tech companies to diversify outside China,” according to Dan Ives, a senior equity analyst at Wedbush Securities, who pointed to the high number of trained engineers in the country as one factor.

“We’re not just talking about (manufacturing of) low-cost electronics,” he told CNN. “We’re talking higher up the value chain… That was not even on the radar (of foreign companies) two years ago.”

Once enemies in war, the United States and Vietnam have grown increasingly close — the value of US imports of Vietnamese goods s﻿oared more than 360% in the decade to end-2023 to top $144 billion, according to US government data.

In September, the two countries formally upgraded their diplomatic ties to a “comprehensive strategic partnership,” a symbolic yet highly important move that positions Vietnam as a destination for more US investment, including for critical technologies like semiconductor chips.

Apple CEO Tim Cook at a visit to a school in Hanoi on April 16, 2024. Tuan Hung/VNExpress/AP

Intel (INTC) has also taken note of Vietnam’s rise. In 2021, the company committed $1.5 billion to a sprawling campus just outside Ho Chi Minh City, which it says will be its largest single assembly and test facility in the world.

At the same time, relations between the United States and China have deteriorated. A trade war between the two countries, which began in 2018 when Washington slapped tariffs on many Chinese imports, ratcheted up last year as both sides introduced tit-for-tat chipmaking export controls.

During the pandemic, meanwhile, China’s strict zero-Covid policy scrambled global supply chains, demonstrating the risks of concentrating production in a single location.

Notably, the world’s biggest iPhone factory, located in central China and owned by Taiwanese manufacturing firm Foxconn, was forced to temporarily shut down in 2022 after workers revolted over fears of the spread of coronavirus.

Consumer market

Vietnam has another advantage, says Nguyen: A booming, educated, and youthful population. That’s a big draw for foreign tech companies looking to hire workers for their factories, and find consumers for their products.

“Vietnam has a population of 100 million people. If it was in Europe, it would be the biggest country,” she said, also noting that smartphone adoption in Vietnam was rapidly increasing.

The International Monetary Fund expects Vietnam’s economy to growth 5.8% this year, much faster than the predicted global average of 3.2%. For 2025, the fund forecasts growth of 6.5% in Vietnam. That’s not far off India’s pace of expansion.

Still, Vietnam represents a far smaller market than India, which has also been wooing large foreign companies, including Tesla (TSLA), to set up factories in the country.

For now, Vietnam’s attractiveness to foreign firms is “more around supply than demand,” says Ives at Wedbush Securities, while, for India, it encompasses both.

Juliana Liu contributed reporting."
"{'id': 'business-insider', 'name': 'Business Insider'}",Shubhangi Goel,China just made it even harder for people in the country to access WhatsApp and Threads,The Chinese government made Apple remove two apps – just as US considers the same thing for TikTok.,https://www.businessinsider.com/whatsapp-threads-removed-from-china-apple-store-government-order-2024-4,https://i.insider.com/6621e81149058e6693578cbb?width=1200&format=jpeg,2024-04-19 03:59:32+00:00,"Apple has removed WhatsApp and Threads from its Chinese app store following a government order.

WhatsApp has been blocked in China since 2017 and its parent company Meta since 2009.

Other Western platforms like Gmail, YouTube, Snap, and Spotify have also been censored in China.

NEW LOOK Sign up to get the inside scoop on today’s biggest stories in markets, tech, and business — delivered daily. Read preview Thanks for signing up! Access your favorite topics in a personalized feed while you're on the go. download the app Email address Sign up By clicking “Sign Up”, you accept our Terms of Service and Privacy Policy . You can opt-out at any time.

Advertisement

Apple removed WhatsApp and Threads from its app store in China after being told to do so by the Chinese government, according to the Wall Street Journal.

China's top internet regulator asked Apple to remove the two apps because of national security concerns.

""We are obligated to follow the laws in the countries where we operate, even when we disagree,"" an Apple spokesperson told The Journal.

Related stories

The Chinese government has blocked WhatsApp since 2017, while its parent company, Meta, has been blocked since 2009. Other Western media platforms, including Gmail, YouTube, Snapchat, and Spotify, have also been censored in China.

Advertisement

Some users find ways to access these platforms through virtual private networks, but removal from the app store may prevent this.

Apple did not immediately respond to Business Insider's request for comment sent outside normal business hours.

A Meta spokesperson referred BI to Apple for comment.

WhatsApp has over 2 billion users globally, while Instagram Threads, which launched in July, has over 130 million global users, CEO Mark Zuckerberg said in February.

Advertisement

China is an important manufacturing and consumer market for Apple. CEO Tim Cook visited the country last month to open a new store in Shanghai and rub elbows with top policymakers. That visit came after iPhone sales dropped earlier this year. And in January, Chinese chipmakers drew up plans to create chip production lines to supply processors to local smartphone makers. The move stands to hurt Apple, which has so far benefited from tight export restrictions.

China's direction to Apple comes as US policymakers debate a ban on TikTok, the popular Chinese app. Some lawmakers are concerned about data harvesting and political influence. The bill would prevent Apple and Google from distributing TikTok's app in their app stores and ban US websites from hosting TikTok."
"{'id': 'fortune', 'name': 'Fortune'}","Mark Gurman, Sarah Zheng, Bloomberg",Apple removes Meta-owned WhatsApp and Threads from its China app store after Beijing deemed them national security risks,"Apple said it was obliged to remove the apps after an order from China's internet regulator, the Cyberspace Administration of China.",https://fortune.com/asia/2024/04/19/apple-removes-meta-whatsapp-threads-china-app-store-beijing-order-national-security/,"https://fortune.com/img-assets/wp-content/uploads/2024/04/GettyImages-2105321058-e1713500275223.jpeg?resize=1200,600",2024-04-19 04:21:10+00:00,"Apple Inc. removed social media services including Meta Platforms Inc.’s WhatsApp and Threads from its Chinese app store, responding to orders from Beijing to close more loopholes in the country’s longstanding internet firewall.

The iPhone maker also removed the messaging services Telegram and Signal, according to consultants tracking the space. Apple, which has consistently complied with one of the world’s most rigid internet censorship regimes, said the Cyberspace Administration of China ordered the apps removed over national security concerns.

The orders come on the heels of a cleanup program Chinese regulators initiated in 2023 that was expected to remove many defunct or unregistered apps from domestic iOS and Android stores, including local ones. In August, China asked all mobile app developers to register with the government by the end of March, or cease operating.

Beijing has barred the use of foreign messaging and social media platforms like WhatsApp for years, using what the industry calls the Great Firewall. That’s helped apps like Tencent Holdings Ltd.’s WeChat dominate domestic usage, though Chinese users can still employ virtual private networks to view foreign media.

Less sensitive apps with more substantial Chinese businesses such as Duolingo are expected to comply with the latest regulatory licensing regime to remain operational, said Rich Bishop, co-founder and chief executive officer of AppInChina.

“It will mean that Chinese consumers are pretty much limited to just Chinese apps, with a small number of international ones,” said Bishop, whose consultancy has received dozens of inquiries from companies about how to stay compliant and publish software in China. “That’s quite a big change — so it will further cut off Chinese citizens from the rest of the world in a sense.”

The action against the American tech services comes as the U.S. government is taking steps toward a ban on TikTok, the hit video app from Beijing-based ByteDance Ltd. U.S. politicians have also cited national security concerns in their push to force the company to either sell TikTok to a non-Chinese owner or face a ban in the U.S. market.

“We are obligated to follow the laws in the countries where we operate, even when we disagree. The Cyberspace Administration of China ordered the removal of these apps from the China storefront based on their national security concerns,” Apple said in a statement. “These apps remain available for download on all other storefronts where they appear.”

The app registration process kicked off last year in what Beijing painted as a bid to counter telephone scams and fraud. The Ministry of Industry and Information Technology said that it would carry out supervision work on those filings from April to June, and to take action against unregistered apps. Developers would also be required to set up and improve mechanisms to handle “illegal information.”

The MIIT move was regarded as another step by Beijing to tighten controls across its cyberspace, forcing internet companies to scrub information considered politically sensitive. Beyond apps, websites and large language AI models have also been subject to greater content curbs.

The Wall Street Journal was first to report the app removal. A Meta spokesperson referred Bloomberg News to Apple’s statement. Representatives for Telegram and Signal didn’t respond to requests for comment.

China’s action comes as TikTok divestiture legislation is expected to be included in a fast-moving aid package for Ukraine and Israel that Congress is expected to vote on this Saturday.

China is a key nation for the iPhone, its largest consumer market outside the U.S. and its primary production base. Chief Executive Officer Tim Cook visited the country earlier this year and emphasized its importance to his business. Apple has long said that it needs to follow local laws as part of operating its app store effectively in different countries."
"{'id': 'cnn', 'name': 'CNN'}",Juliana Liu,"Apple deletes WhatsApp, Threads from China app store on orders from Beijing | CNN Business","Apple has removed WhatAapp and Threads from its app store in China, following an order from the country’s internet watchdog which cited national security concerns.",https://www.cnn.com/2024/04/19/tech/china-apple-whatspp-threads-removal-hnk-intl/index.html,"https://media.cnn.com/api/v1/images/stellar/prod/gettyimages-1197056111-20240419050840738.jpg?c=16x9&q=w_800,c_fill",2024-04-19 07:06:48+00:00,"Editor’s Note: Sign up for CNN’s Meanwhile in China newsletter which explores what you need to know about the country’s rise and how it impacts the world.

Hong Kong CNN —

Apple has removed WhatsApp and Threads from its app store in China, following an order from the country’s internet watchdog which cited national security concerns.

“We are obligated to follow the laws in the countries where we operate, even when we disagree,” an Apple spokesperson told CNN on Friday. “The Cyberspace Administration of China ordered the removal of these apps from the China storefront based on their national security concerns. These apps remain available for download on all other storefronts where they appear.”

The apps, both owned by Meta (META), were already blocked in China and not widely used. They could be accessed in the country only by using virtual private networks (VPNs) that can encrypt internet traffic and disguise the user’s online identity.

The removal of the apps by Apple (AAPL) represents a “further distancing between already separated tech universes” in the country and beyond, said Duncan Clark, chairman of Beijing-based investment advisory BDA China.

“It will cause inconvenience to consumers and businesses (in China) who deal with family, friends or customers overseas. Even if they use VPNs to access their existing WhatsApp apps, these over time will become obsolete and require updating,” he said.

Other popular Western social media apps including X (formerly Twitter), Facebook, Instagram and Messenger are still available on Apple’s China app store, according to a check by CNN.

The tech giant’s announcement comes against a backdrop of plunging iPhone sales in the world’s second largest economy. Its smartphone sales tumbled a stunning 10% in the first quarter of this year, according to market research firm IDC.

The company has lost momentum in China as nationalism, a rough economy and increased competition have hurt Apple over the past several months.

The resurgence of Huawei and other Chinese brands, including Xiaomi and OPPO/OnePlus, will likely continue, according to IDC. Chinese consumers who once would have considered Apple are now turning to the country’s national brands.

Besides being a key production center, China remains an important market for Apple as it is the largest market behind the United States. The company continues to offer discounts in the country to help boost sales.

Its CEO Tim Cook visited Shanghai just last month to open the second biggest Apple store in the world.

— Hassan Tayir contributed reporting."
