source,author,title,description,url,urlToImage,publishedAt,content
"{'id': 'business-insider', 'name': 'Business Insider'}",jsor@businessinsider.com (Jennifer Sor),"Apple stock is down 10% this year, but there are 5 reasons for investors to remain bullish, Wedbush says","Apple stock could soar nearly 50% higher this year thanks to five bullish factors for iPhone maker, according to Wedbush.",https://markets.businessinsider.com/news/stocks/apple-stock-price-outlook-iphone-upgrade-ai-china-demand-wedbush-2024-4,https://i.insider.com/5c2e1d1d0df17623256b8296?width=1200&format=jpeg,2024-04-09 14:40:48+00:00,"Apple stock is down about 12% this year but could still see stellar gains in 2024, according to Wedbush.

The iPhone maker has 48% upside, the firm said, outlining five bullish tailwinds for the stock.



NEW LOOK Sign up to get the inside scoop on today’s biggest stories in markets, tech, and business — delivered daily. Read preview Thanks for signing up! Access your favorite topics in a personalized feed while you're on the go. download the app Email address Sign up By clicking “Sign Up”, you accept our Terms of Service and Privacy Policy . You can opt-out at any time.

Advertisement

Apple stock has had a disappointing year so far, but there are still reasons for investors to stay bullish on the iPhone maker, according to Wedbush.

The firm pointed to a ""black cloud"" hanging over the company, with Apple shares sliding 10% for a loss of over $200 billion in market value so far in 2024. That loss comes amid demand concerns in China, where Apple is battling a government crackdown on iPhones and fierce competition from China-based rivals, like Huawei.

""It's clear that Apple is navigating one of the more difficult China demand environments we have seen the last 5 years as a combination of factors has created a perfect storm for Cupertino in this key market,"" analysts said in a note on Tuesday, estimating that iPhone sales in China would likely fall ""moderately"" below estimates in March.

But Apple stock still has the potential to deliver big gains this year, analysts said, maintaining their ""outperform"" rating and $250 price target on the stock, the highest estimate on Wall Street.

Advertisement

A rise to that level implies 48% upside for Apple, which Wedbush said could stem from five bullish factors:

iPhone sales could be strong overall this year. 2024 estimates are ""hittable"" despite some conservative 2025 estimates for iPhone sales, analysts noted. There could be pent-up demand for iPhones, given how many users are due for an upgrade. Wedbush estimated there were around 270 million iPhones that could be swapped for a newer version, especially as Apple is set to roll out its iPhone 16 this year. Services revenue for the company remains ""rock solid,"" Wedbush analysts said. Apple pulled record-high revenue from the services side of its business over the first quarter, according to its latest earnings report. The company is integrating AI into its devices. Apple is set to make an announcement on its progress with generative artificial intelligence at its Worldwide Developers Conference in June, Wedbush predicted. Apple still dominates the smartphone market, with 2.2 billion of its devices being used around the world. That's the ""strongest installed base of any company,"" analysts noted.

Over the medium term, investors are eyeing Apple's next quarterly earnings report, which is set to roll out on May 2.

""The Street is bracing for a brutal March quarter and soft June guidance which we believe could be the last few quarters of this growth storm as Apple starts to see a renaissance of growth heading into the September quarter and FY25,"" Wedbush said. ""While some patience is required to navigate this China weakness, we believe the seeds for an Apple growth turnaround are being planted in the field.""

Advertisement

Most analysts on Wall Street have maintained a ""strong-buy"" rating for the stock, according to data from the Nasdaq Exchange. The average price target for Apple stood at $202 a share, implying a 20% upside for the stock."
"{'id': 'fortune', 'name': 'Fortune'}",Priya Abani,I lead one of the startups accusing Apple of copyright infringement. Here’s why Congress should side with us,"The David vs. Goliath battle over the Apple Watch has reached President Joe Biden’s desk–and, now, the halls of Congress.",https://fortune.com/2024/04/09/startups-accusing-apple-of-copyright-infringement-congress-tech-politics/,"https://fortune.com/img-assets/wp-content/uploads/2024/04/GettyImages-1863294002-e1712677384210.jpg?resize=1200,600",2024-04-09 15:45:41+00:00,"When I became CEO of AliveCor, a health tech startup dedicated to heart health, little did I know that we would spend years engaged in a legal fight to protect our intellectual property from one of the largest companies in the world. But our David vs. Goliath battle against Apple has even reached President Joe Biden’s desk–and, now, the halls of Congress.

Some people ask me why we haven’t given up, given Apple’s massive war chest and well-documented history of copying other firms’ ideas. As The Washington Post once reported, “Some apps have simply buckled under the pressure.”

But this isn’t just about us. It’s about the entire tech ecosystem. It’s a question of whether startups–and small businesses of all kinds–can stand up for their rights and win. And because we focus specifically on health tech, it’s no exaggeration to say that when it comes to technologies developed by companies like ours, lives hang in the balance.

Here’s what the case is all about, in a nutshell. AliveCor pioneered electrocardiogram technologies (ECG) for smartphones and smartwatches. In 2016 we launched KardiaBand, an FDA-cleared, medical-grade wearable ECG. The responses were wonderful, with people saying it helped to transform their health and their lives. But two years later, Apple announced that it had created its own technology–and made its new watches incompatible with a central feature of KardiaBand.

Equipped with patents, scientific reports, and other evidence, we fought back. Since then, Apple has tried all sorts of maneuvers to fend us off, including bombarding us with expensive litigation. Nevertheless, we’ve been winning before the International Trade Commission (ITC). The agency’s role includes investigating and making determinations involving intellectual property (IP) rights in such cases.

The ITC found Apple to be in violation of the IP protecting our vital heart monitoring technology. As a result, the commission ultimately called for a ban on Apple importing its infringing watches into the United States. The corporate behemoth tried to get President Biden to veto that ban, but fortunately, he declined to do so.

We’re not alone in this kind of fight. Another medical technology company, Masimo, has been engaged in a similar battle, and also won before the ITC. Again, Biden refused to veto an Apple Watch import ban.

But rather than attempt to rectify its wrongs, Apple is trying to use its lobbying power to change the ITC. The company is lobbying Congress to “make some patent owners ineligible to bring complaints before the ITC,” and seeking “to influence the language of committee reports that could affect how the agency levels punishments.”

Apple is also trying another desperate, last-ditch effort. It got the U.S. Patent and Trademark Office’s Patent Trial and Appeal Board to invalidate some of our patents, but we’re confident that our appeal will reverse that decision.

Apple is attempting to argue that an ITC ban on Apple Watch imports would deprive people of a device that is crucial to their health. However, the commission has previously dismissed this argument as inaccurate. In fact, the opposite is true: Allowing Apple to get away with continued infringement will kill innovation and endanger people’s health.

Health tech startups rely on investor funding to save lives. People are willing to invest in these new ideas because they expect that some will succeed, so they’ll recoup their investments and see a future payoff.

If large corporations can simply copy these technologies, then investors will lose the confidence and incentive to provide funding at various stages. Investors and small business leaders need to know that the rules fairly and reliably protect the Davids in the same way that they protect the Goliaths.

Our battle against Apple has always taken place on an uneven field. The intervention of Congress on Apple’s behalf would make things even worse. President Biden stood up to Apple’s bullying tactics–and Congress should do the same.

Priya Abani is the CEO of AliveCor.

More must-read commentary published by Fortune:

Glassdoor CEO: ‘Anonymous posts will always stay anonymous’

We analyzed 46 years of consumer sentiment data–and found that today’s ‘vibecession’ is just men starting to feel as bad about the economy as women historically have

90% of homebuyers have historically opted to work with a real estate agent or broker. Here’s why that’s unlikely to change, according to the National Association of Realtors

Intel CEO: ‘Our goal is to have at least 50% of the world’s advanced semiconductors produced in the U.S. and Europe by the end of the decade’

The opinions expressed in Fortune.com commentary pieces are solely the views of their authors and do not necessarily reflect the opinions and beliefs of Fortune."
"{'id': 'fortune', 'name': 'Fortune'}","Anna J. Kaiser, Mark Gurman, Bloomberg","Apple joins tech exodus to Florida— iPhone maker plans a 45,000 square foot office near Miami",The company joins other tech firms including Amazon and Microsoft in venturing south.,https://fortune.com/2024/04/09/apple-florida-iphone-office-miami/,"https://fortune.com/img-assets/wp-content/uploads/2024/04/GettyImages-2077025425-e1712703595479.jpg?resize=1200,600",2024-04-10 00:16:40+00:00,"Apple Inc. is upgrading its presence in the Miami area, following other Big Tech companies in setting up outposts or expanding in South Florida.

Apple is taking 45,000 square feet (4,181 square meters) in a new building in Coral Gables, a wealthy suburb just south of Miami, according to people familiar with the matter, who asked not to be identified because the plans are private.

Apple declined to comment.

The company already has a smaller office in the vicinity, which has focused mostly on Latin America as well as the advertising business, including selling ad slots in the App Store. The firm is also expected to open a large new retail store location at the $4 billion Worldcenter development in Miami.

South Florida has been a magnet for the ultra-wealthy and their companies since the pandemic upended the U.S. economy, with firms either outright moving to the area or expanding their footprints. Amazon.com Inc. is looking for roughly 50,000 square feet in Miami, after founder Jeff Bezos moved to Florida from Seattle. Microsoft Corp. has also leased a new office in the city, in the same building that will serve as headquarters for Ken Griffin’s Citadel.

Apple’s new Miami space will be at The Plaza Coral Gables, a project bankrolled by Agave Holdings, a Mexican family office powered by tequila money. Raymond James has also set up shop in the building.

The increased demand for office space has led to sharp increase in rents. Asking rates on commercial properties in Miami are now close to $57 a square foot, according to commercial real estate adviser Avison Young."
"{'id': 'financial-post', 'name': 'Financial Post'}",Bloomberg News,Apple Urged to Speak Out on Vietnam’s Jailed Climate Activists,"Apple Inc. has been urged by more than 60 human rights and environmental organizations to publicly oppose the detention of climate activists in Vietnam, an increasingly important nation in its supply chain.",https://financialpost.com/pmn/business-pmn/apple-urged-to-speak-out-on-vietnams-jailed-climate-activists,https://smartcdn.gprod.postmedia.digital/financialpost/wp-content/uploads/2024/04/776081209.jpg,2024-04-11 07:58:21+00:00,"Apple Inc. has been urged by more than 60 human rights and environmental organizations to publicly oppose the detention of climate activists in Vietnam, an increasingly important nation in its supply chain.

“You have a responsibility to weigh in on the systematic persecution and imprisonment of climate leaders in the country,” the groups, which include 350.org and Global Witness, said in a letter Thursday to Apple’s leadership team and board.

We apologize, but this video has failed to load.

(Bloomberg) — Apple Inc. has been urged by more than 60 human rights and environmental organizations to publicly oppose the detention of climate activists in Vietnam, an increasingly important nation in its supply chain.

This advertisement has not loaded yet, but your article continues below.

Create an account or sign in to continue with your reading experience.

Subscribe now to read the latest news in your city and across Canada.

Subscribe now to read the latest news in your city and across Canada.

Article content

“By not making a public statement on this matter, you risk violating your own environmental and human rights policies,” the letter said. Vietnam has seen about a fourfold increase in companies assembling Apple products over the past decade.

Read More: Apple’s iPhone Supply Chain Splinters Under US-China Tensions

The US and the United Nations have previously criticized Vietnam over the jailing of environmentalists on tax evasion charges, including Hoang Thi Minh Hong, a former Obama Foundation scholar, and Nguy Thi Khanh. Activists argue authorities are using the detentions as part of efforts to limit transparency on the country’s energy transition.

“In Vietnam, no one is convicted for environmental activism,” Ministry of Foreign Affairs deputy spokesperson Doan Khac Viet said in an emailed statement. “Those who claim to ‘do activities for the environment’ but violate the law have been punished strictly in accordance with the law.”

Apple did not immediately respond to a request for comment outside of usual business hours.

The nation — which relies on fossil fuels for more than half its power generation — in 2022 entered into a $15.5 billion partnership with funders led by the European Union and the UK to help finance its transition away from coal.

—With assistance from John Boudreau, Vlad Savov and Nguyen Xuan Quynh.

(Updates the story in the fifth paragraph with Vietnam Ministry of Foreign Affairs comment.)"
"{'id': 'business-insider', 'name': 'Business Insider'}",fdemott@insider.com (Filip De Mott),"2 reasons Apple's stock still has 25% upside despite struggling to start 2024, according to JPMorgan","JPMorgan holds a $210 price target on Apple, expecting iPhone volumes to accelerate in 2026 thanks to an AI-led upgrade.",https://markets.businessinsider.com/news/stocks/apple-stock-outlook-ai-iphone-5g-valuation-china-regulation-jpmorgan-2024-4,https://i.insider.com/6617db701caec1275a6ef70e?width=1200&format=jpeg,2024-04-11 14:40:38+00:00,"JPMorgan holds a $210 price target on Apple, citing improving sentiment among investors.

Enthusiasm is growing amid anticipation of an AI-led upgrade cycle that could boost sales.

Apple's stock plummet is also making its valuation more attractive.

NEW LOOK Sign up to get the inside scoop on today’s biggest stories in markets, tech, and business — delivered daily. Read preview Thanks for signing up! Access your favorite topics in a personalized feed while you're on the go. download the app Email address Sign up By clicking “Sign Up”, you accept our Terms of Service and Privacy Policy . You can opt-out at any time.

Advertisement

Apple's 2024 has been a struggle so far, as deteriorating data points have cut into its market performance. But according to JPMorgan, it isn't deterring enthusiasm among hedge fund investors, who are holding out for future upside.

The reasons? An AI-led iPhone upgrade cycle, and a moderating valuation premium, the bank outlined.

These same factors are behind JPMorgan's own bullishness, holding a price target of $210 per share. That represents a 25% gain from current levels, with Apple trading at $168.71 as of 9:20 a.m. ET.

First, rising investor appetite for Apple is chiefly coming from expectations of an AI-driven boost, similar to how the 5G upgrades helped shares skyrocket in 2020.

Advertisement

As with 5G, the introduction of on-device AI upgrades would likely ramp up the phone replacement cycle for 2 to 3 years, as the technology is expected to be only available on newer generation phones, JPMorgan said.

The bank expects iPhone 17 to be Apple's first ""AI phone,"" scheduled to come out September 2025.Due to this, JPMorgan anticipates 2026 iPhone volumes to accelerate to 240 million units.

""The product cycle will drive an inflection in the revenue and earnings growth in our estimate to 14% and 21% in FY26, respectively, relative to expectations for more muted outcomes in FY24 and FY25,"" the note said.

This puts JPMorgan's earnings forecast 7% ahead of consensus.

Advertisement

Second, the fact that Apple has slid 13.3% year-to-date means that it's now trading at the lower end of a range of multiples, as seen during the 5G cycle momentum.

""Contrary to the deterioration of fundamentals relative to both Hardware demand as well as outlook for Services growth, the interest in AAPL shares have improved from the broader group of investors who have otherwise been averse to the premium valuation multiple despite one of the lowest growth outlooks relative to the other Mega Cap Tech stocks,"" JPMorgan wrote.

Despite increased 2026 estimates, the bank continues to expect downside risks in the near-term for Apple. The company has been burdened by competitive pressures out of China and increasing regulatory scrutiny."
"{'id': 'business-insider', 'name': 'Business Insider'}",mfox@businessinsider.com (Matthew Fox),"Apple's earnings power is once again being overlooked by investors, positioning the stock for 28% upside, BofA says","In 2018, Wall Street estimated Apple would see profit margins of about 39% in 2023. Margins were in fact considerably higher at 44%.",https://markets.businessinsider.com/news/stocks/apple-stock-price-outlook-big-upside-wall-street-underestimates-profits-2024-4,https://i.insider.com/661837d03f923f7dab070876?width=1200&format=jpeg,2024-04-12 13:06:54+00:00,"Investors are once again underestimating the earnings potential of Apple, according to Bank of America.

The bank said profit margins for Apple could come in significantly higher than Wall Street expects going forward.

The bank reiterated its $225 price target, representing potential upside of 28%.

NEW LOOK Sign up to get the inside scoop on today’s biggest stories in markets, tech, and business — delivered daily. Read preview Thanks for signing up! Access your favorite topics in a personalized feed while you're on the go. download the app Email address Sign up By clicking “Sign Up”, you accept our Terms of Service and Privacy Policy . You can opt-out at any time.

Advertisement

Wall Street is once again underestimating the earnings potential of Apple, and that should lead to significant upside for the stock price going forward, according to a Thursday note from Bank of America.

It's been a tough go of it for Apple so far this year, with the stock down 9% as investors grow increasingly concerned about where future growth will come from. But Bank of America analyst Wamsi Mohan said Apple has plenty of levers to pull when it comes to boosting its profits above expectations.

""We see upside from vertical integration and mix on the product side that could account for over 100bps of GM upside,"" Mohan said.

And on the services side, Mohan sees another 100 basis points of potential growth margin upside ""driven by lower cost delivery from AAPL-based datacenters and silicon.""

Advertisement

In other words, Apple's use of in-house designed chips and reducing its reliance on public cloud providers should drive significant cost savings.

Altogether, those estimates suggest that Apple could considerably surprise Wall Street to the upside where it matters most: profit growth.

A similar scenario played out in 2018, according to the bank, when Wall Street estimated Apple's profit margins would hit 39% in 2023. It turned out Apple's profit margins were materially higher, coming in at 44% in 2023.

""In our opinion, the Street continues to underestimate the long-term gross margin potential for Apple across both products and Services yet again, where we see about 180bps of Product gross margin upside and about 150bps of Services margins upside over the next few years,"" Mohan said.

Advertisement

Part of the Services upside could come from Apple's highly anticipated introduction of an iPhone with Generative AI capabilities, according to Mohan, while profit upside on the product side could come from higher iPhone prices as consumers continue to favor the more expensive ""Pro"" iPhone models.

Bank of America reiterated its ""Buy"" rating and $225 price target in a note on Thursday, representing potential upside of 28% from Thursday's close."
"{'id': 'business-insider', 'name': 'Business Insider'}",Sarah Jackson,Apple fans are eager for any sign at all of its AI intentions after a rough year,Apple jumped on Thursday after a report its Macs will include AI-focused chips. It shows just how important its future AI plans are to investors.,https://www.businessinsider.com/apple-investors-eager-for-sign-of-ai-plans-mac-chip-2024-4,https://i.insider.com/66194c9b3f923f7dab0746f4?width=1200&format=jpeg,2024-04-12 17:59:30+00:00,"Fans and investors are hoping that AI might help save what's shaping up to be a bad year for Apple.

On Thursday, Apple shares rose more than 4% on news it plans to revamp Macs with an AI-focused chip.

Apple watchers have been seeking some good news amid its antitrust and China sales issues.

NEW LOOK Sign up to get the inside scoop on today’s biggest stories in markets, tech, and business — delivered daily. Read preview Thanks for signing up! Access your favorite topics in a personalized feed while you're on the go. download the app Email address Sign up By clicking “Sign Up”, you accept our Terms of Service and Privacy Policy . You can opt-out at any time.

Advertisement

It looks like Apple investors will jump at any sign of good news on the AI front after the company's rough start to the year.

On Thursday, Apple rose more than 4% after Bloomberg reported that it will overhaul its Mac lineup with new M4 processors focused on AI.

It was the best day for Apple's stock since May and a welcome boost after a number of setbacks this year have weighed on the shares. It's also a sign that investors are watching very eagerly for even the smallest signal that Apple is taking steps toward an AI-led future."
"{'id': 'cnn', 'name': 'CNN'}",Samantha Murphy Kelly,The iPhone suggests a Palestinian flag when some people type ‘Jerusalem.’ Apple is working on a fix | CNN Business,Apple is working to a fix a bug in its latest iOS software that suggests the Palestinian flag emoji when some users search for the word “Jerusalem” in the emoji keyboard.,https://www.cnn.com/2024/04/12/tech/apple-iphone-jerusalem-palestinian-flag/index.html,"https://media.cnn.com/api/v1/images/stellar/prod/gettyimages-1683373855.jpg?c=16x9&q=w_800,c_fill",2024-04-12 19:03:35+00:00,"CNN —

Apple is working to a fix a bug in its latest iOS software that suggests the Palestinian flag emoji when some users search for the word “Jerusalem” in the emoji keyboard.

The company told CNN it is aware of a bug within predictive emoji in the keyboard and is working on a fix that will be made available in the next iOS update.

Apple’s latest software, iOS 17.4.1, was introduced on March 21, but the recent discovery of the bug upset some users on social media. In one post on X viewed more than 2.3 million times, an iPhone user questioned whether Apple was aware of the error – and whether it was intentional. Apple said the issue was a mistake and not coded into the keyboard intentionally.

But the user, who said she was Jewish, provided a long list of other cities that don’t surface a flag when entered into the emoji search box.

It’s possible Apple’s machine-learning technology determined the suggested emoji based on analyzing texts from millions of its users. Apple declined to elaborate on the cause.

The company did not share when the next update would become available.

The history of the region is complicated, and territorial claims in the ancient city are no less so. In 1967, Israel captured East Jerusalem along with other regions and later annexed that as part of Jerusalem to unify the city as its capital – although much of the international community recognizes East Jerusalem as Israel-occupied Palestinian territory. For its part, Israel considers Jerusalem as its undivided capital. In 2017, the US administration of President Donald Trump recognized Jerusalem as Israel’s capital, reversing decades of American foreign policy.

So suggesting a Palestinian flag emoji for the search query “Jerusalem,” particularly when Israel is at war with Hamas, is adding to tensions amid a long-running dispute."
