source,author,title,description,url,urlToImage,publishedAt,content
"{'id': 'newsweek', 'name': 'Newsweek'}",,Apple Brought Justice Department's Antitrust Lawsuit on Itself | Opinion,"No one company should have so much power over other private enterprises. To the extent we even have antitrust laws, this is why they exist.",https://www.newsweek.com/apple-brought-justice-departments-antitrust-lawsuit-itself-opinion-1883300,https://d.newsweek.com/en/full/2369084/tim-cook-apple-logo.jpg,2024-03-27 19:57:26+00:00,"Even if you're a fan of small, limited, or no government at all, and even if you're suspicious of the Biden administration's motives in general, as a consumer you should be overjoyed at the news that the Justice Department is suing Apple for a litany of antitrust violations.

The company willfully and ruthlessly brought the lawsuit on itself by running what is effectively an app store monopoly, one led by a CEO whose unilateral power to ban anyone, anytime, for anything rivals any dictatorship in its sheer capriciousness.

The list of Apple's anti-competitive practices is long. Killing software marketplace competition and forcing 30 percent credit card commissions. Funky rules like ""if you mention you can get a better price on the web we will ban your app."" Prohibiting alternative app stores. Blocking interoperability with other platforms. Favoring its own hardware over competitors'. Creating its own pre-loaded apps that compete with private developers who spent years working on their products.

And it's not just the way Apple deals with other businesses—it's the way it deals with consumers too. It can brick your phone, delete any app at any time, track you and your habits, and censor what you install. You have no say in the matter. Do you really even own your phone? Or did you just pay Apple $1,000 for the privilege of being allowed to use it?

It was all anticompetitive all along, and yet Apple has gotten away with it because many weren't savvy enough to understand what the Silicon Valley giant was up to—and the company lobbied heavily to keep it that way.

This is a fight that's going to last for years. It's going to be ugly, but in the end the government absolutely has to ensure that if it wins, Apple can't engage in malicious compliance to satisfy a court's order.

What do I mean by ""malicious compliance?"" Well, look what happened when a judge ordered the company to accept alternative payment methods in its app store. After the Supreme Court wouldn't take the case, Apple said, ""ok fine, but you have to get our permission to take alternative payments, and you have to keep offering our payment system too, and you have to pay a 27 percent commission on sales.""

TOPSHOT - Tim Cook, chief executive officer of Apple Inc., speaks during a launch event for the new Apple iPhone 15 at Apple Park in Cupertino, California, on September 12, 2023. TOPSHOT - Tim Cook, chief executive officer of Apple Inc., speaks during a launch event for the new Apple iPhone 15 at Apple Park in Cupertino, California, on September 12, 2023. Nic Coury / AFP/Getty Images

That's not ""open up your platform,"" that's ""we have lots of lawyers.""

It's not just in the U.S. either—just look at what the company did in the EU when it was forced to comply with ""digital gatekeeper"" rules. Apple ""opened"" its platform to alternative app stores and payment methods, but only if large developers complied with a new fee.

I, of course, have some skin in the anti-Apple game. In 2021 I was CEO of a company that had the fastest-growing app in Apple's store. And then, just like that, we were gone. Deplatformed, off the iPhone, not accessible, after being given an arbitrary demand and 24 hours to comply.

Imagine having 15 million users disappear with the click of a button on one day's notice because public media perception changes.

And while I understand that the circumstances around our app—Parler—were highly unique, and I'm not excusing anyone's misbehavior by any means, the fact remains that Apple wields almost unprecedented power to destroy companies at any time, for any reason, with little to no warning.

This is one case where, even as a fan of limited government and free enterprise, I absolutely hope the Justice Department prosecutes vigorously. Apple needs to be held accountable. The iPhone needs alternative app stores, sideloading (like Android), multiple payment options, interface parity for third-party hardware, and frankly any other change the government can think of to bust up the monopoly.

No one company should have that much power over other private enterprises. To the extent we even have antitrust laws, this is why they exist.

John Matze is the CEO of the social media platform Hedgehog.

The views expressed in this article are the writer's own."
"{'id': 'business-insider', 'name': 'Business Insider'}",Aaron Mok,Ex-Apple leader says iPhone maker is in a 'battle for the soul' as it goes up against the DOJ,"Ex-Apple employee Michael Gartenberg says Apple is fighting for its ""soul"" amid the DOJ's anti-trust lawsuit, per WSJ.",https://www.businessinsider.com/ex-apple-insider-says-company-is-in-battle-for-soul-2024-3,https://i.insider.com/65a51a39dcdb354a98578864?width=1200&format=jpeg,2024-03-28 08:05:01+00:00,"By clicking “Sign Up”, you accept our Terms of Service and Privacy Policy . You can opt-out at any time.

Access your favorite topics in a personalized feed while you're on the go. download the app

Sign up to get the inside scoop on today’s biggest stories in markets, tech, and business — delivered daily. Read preview

A former Apple employee said the iPhone maker's battle with the DOJ over anti-trust accusations threatens its core identity.

""This is a battle for the soul of Apple,"" Michael Gartenberg, once the senior director of the tech giant's worldwide product marketing team, told the Wall Street Journal. ""Governments around the world are trying to take apart Apple's DNA strand by strand.""

This story is available exclusively to Business Insider subscribers. Become an Insider and start reading now.

Gartenberg's comments come after the US Department of Justice sued Apple, accusing it of engaging in anti-competitive practices to crowd out the smartphone market.

The DOJ pointed to everything from janky iPhone-Android messaging to limited third-party smartwatch compatibility with the iPhone as evidence for the company's alleged misconduct. It's the latest addition to Apple's woes following a nearly $2 billion fine from the EU over its App Store policies and declining iPhone sales in China.

Advertisement

In a statement to Business Insider, Gartenberg said that Apple has always tried to present itself as a company that prioritizes customers, whereas the DOJ sees the company as putting shareholders first.

Apple didn't immediately respond to a request for comment from Business Insider before publication.

Related stories

Before leaving the company, Gartenberg, according to the WSJ, worked under Phil Schiller — the ex-senior vice president of the worldwide marketing team who appears to have played a key role in defending Apple's perceived anti-competitive tactics.

In 2016, Schiller forwarded an email to CEO Tim Cook that ""moving iMessage to Android will hurt us more than help us."" The DOJ cited the exchange in its suit as evidence of illegal behavior.

Advertisement

Since stepping down from his executive role in 2020, Schiller, now an ""Apple Fellow"" who oversees the App Store, appears to keep defending Apple's business practices.

In 2021, Schiller was a key witness in Epic Games' antitrust lawsuit against Apple. The gaming company sued the iPhone maker, claiming it engaged in anticompetitive behavior and illegally maintained a monopoly through its App Store practices. For example, Apple barred games like Fortnite from being sold in third-party app marketplaces. In court, Schiller argued that barring apps from being available from outside marketplaces was primarily a security concern.

In late January, however, the company was forced to allow people access to rival app stores on the iPhone in Europe to comply with the Digital Markets Act, known as DMA.

In response, Schiller said in February that he still believes Apple needs to do whatever it takes to keep its products safe.

Advertisement

""I have no qualms in saying that our goal is going to always be to make the App Store the safest, best place for users to get apps,"" Schiller told Fast Company in February.

""I think users— and the whole developer ecosystem—have benefited from that work that we've done together with them,"" he added. ""And we're going to keep doing that."""
"{'id': 'business-insider', 'name': 'Business Insider'}",Ana Altchek,There's a new scam targeting iPhone owners with a barrage of notifications,"Some iPhone owners have received a series of notifications about resetting their Apple ID password, followed by a spoofed phone call.",https://www.businessinsider.com/iphone-owners-report-reset-password-phishing-scam-call-2024-3,https://i.insider.com/660587653f923f7dab020ff9?width=1200&format=jpeg,2024-03-28 17:30:41+00:00,"Some iPhone owners have been hit with an elaborate new phishing scam, Krebs on Security reports.

The scam involves repeated alerts telling users to reset their Apple password and a spoofed call.

Apple suggests ignoring suspicious messages and calling the company directly if suspicious.

NEW LOOK Sign up to get the inside scoop on today’s biggest stories in markets, tech, and business — delivered daily. Read preview Thanks for signing up! Access your favorite topics in a personalized feed while you're on the go. download the app Email address Sign up By clicking “Sign Up”, you accept our Terms of Service and Privacy Policy . You can opt-out at any time.

Advertisement

There's a new phishing scheme targeting Apple owners, and it's pretty elaborate — and annoying.

Some iPhone owners have received unprompted and repeated notifications to allow a reset of their Apple ID password, a form of attack known as ""MFA bombing,"" according to a report from cybersecurity research and news website Krebs on Security.

Since the notifications come from the Apple device, users can't use their phone until they deny or accept the request to reset.

One user, Parth Patel, posted on X, formerly Twitter, that he received over 100 notifications asking him to reset his password. Patel told Business Insider that he's a cofounder of an AI startup still in stealth.

Advertisement

The attackers made a led high effort focused attack on me, using OSINT data from People Data Labs and caller ID spoofing.



First, around 6:36pm yesterday all of my Apple devices started blowing up with Reset Password notifications.



Because these are Apple system level alerts,… pic.twitter.com/vX1AZvoVoN — Parth (@parth220_) March 23, 2024

The scammer's attempts to gain access to his Apple account didn't end there.

Patel said after 15 minutes of alerts, he received a spoofed call from the Apple Support phone number, telling him again that he needed to reset his password.

Related stories

""I was obviously still on guard, so I asked them to validate a ton of information about me, before answering any of their questions,"" Patel said. ""They got a lot right, from DOB, to email, to phone number, to current address, historic addresses….""

Patel said in his social media post that the only detail they got wrong was his name — which confirmed for him that it was a scam.

Advertisement

Patel told BI that the goal of the scam was likely to get the user to reset their Apple ID password using a one-time code sent over text message. If the user used the one-time code, the attackers could reset the password on the account, lock the user out, and even wipe all their Apple devices.

Another iPhone owner quoted in Krebs on Security said he experienced a similar situation and ended up replacing his phone and making a new Apple account after the phishing attempt, but still received the password-reset requests — leading him to believe the scammer was relying on knowing his phone number to carry out the scheme.

Apple said it has taken steps to address the reported issue.

""We are aware of reports that a small number of iPhone users are receiving a high volume of alerts asking if they are attempting to reset their password,"" an Apple spokesperson told Business Insider.

Advertisement

Apple said scammers often used spoofed calls to claim suspicious activity on an account or device. They aim to get information, money, or even Apple gift cards.

A good rule of thumb is that if you didn't personally try to reset your Apple password, you shouldn't be receiving a request to allow your password to reset. Even if the notifications are annoying and frequent — which should be a red flag anyway — resist the urge to tap ""accept"" to be rid of them.

Customers should assume any suspicious message, call, or request for personal information is a scam and hang up, according to Apple. Apple also said that you should call the company directly if you feel suspicious.

US customers can report scam phone calls to the Federal Trade Commission at reportfraud.ftc.gov or to local law enforcement agencies."
"{'id': 'business-insider', 'name': 'Business Insider'}",Huileng Tan,"A former Apple employee leaked details about products he didn't like from his work iPhone, lawsuit says",Apple accused Andrew Aude of leaking information about projects including the Journal app and Vision Pro to media outlets and other tech companies.,https://www.businessinsider.com/apple-sues-former-employee-andrew-aude-product-leak-work-iphone-2024-3,https://i.insider.com/6606661c16bde8d4ead379f2?width=1200&format=jpeg,2024-03-29 07:34:21+00:00,"Apple is suing a former software engineer for leaking confidential information.

Apple said Andrew Aude shared information about products to media and staff at other companies.

It said Aude still poses a threat because of his knowledge of confidential company information.

NEW LOOK Sign up to get the inside scoop on today’s biggest stories in markets, tech, and business — delivered daily. Read preview Thanks for signing up! Access your favorite topics in a personalized feed while you're on the go. download the app Email address Sign up By clicking “Sign Up”, you accept our Terms of Service and Privacy Policy . You can opt-out at any time.

Advertisement

Apple is suing a former employee who it said leaked confidential information, including about products he didn't like, from his work-issued iPhone.

In a complaint filed on March 18 at a California court, Apple said former software engineer Andrew Aude shared information about projects, including Apple's Journal app and the Vision Pro, to media outlets and employees at other tech companies over a period of five years.

The tech giant is suing Aude, who was hired in 2016, for breaching its confidentiality agreement and violating labor laws.

The lawsuit was first reported by MacRumors.

Advertisement

Apple said it discovered the leaks in late 2023. When confronted, it said Aude denied his involvement but then feigned a bathroom break and ""permanently deleted significant amounts of evidence from his device.""

This included deleting the Signal app — which he used for communications — from his work-issued phone, it said.

But the lawsuit said that Aude often saved screenshots of his communications on his work iPhone ""to preserve them for posterity,"" and Apple was able to retrieve those.

Related stories

According to Apple's lawsuit, an analysis of Aude's Apple-issued work iPhone showed he had over 1,400 encrypted communications with one Wall Street Journal journalist over a four-month period.

Advertisement

Aude also sent a journalist at The Information over 10,000 text messages, and traveled to meet her, according to Apple.

Aude's screenshots were attached to the lawsuit. In one particular leak to the Journal journalist around April 2023, Aude's screenshots showed ""'giddy anticipation"" of the ""chaos"" awaiting the company following the publication of leaked information, Apple said.

Aude had also characterized the leak to other colleagues as a ""necessary evil,"" it added.

""In connection with one leak, Mr. Aude admitted that he violated his obligations to Apple so he could 'kill' products and features with which he took issue,"" Apple said separately in the lawsuit.

Advertisement

Aude's leaking of information led to the publication of multiple news reports, according to Apple.

""His disclosures also have impeded Apple's ability to surprise and delight with its new offerings,"" the tech company said in its lawsuit.

While Aude's employment has been terminated, Apple said he poses an ""ongoing threat"" to the company due to his knowledge of its confidential and proprietary information, as well as his ""long and extensive history of disclosing it to third parties intentionally and without authorization.""

Apple is pursuing a jury trial, damages, and an order directing Aude not to disclose the company's confidential and proprietary information to third parties without its consent. It also wants Aude to give up his discretionary bonuses and restricted stock units.

Advertisement

Apple did not immediately respond to a request for comment, sent outside business hours."
"{'id': 'business-insider', 'name': 'Business Insider'}",Theron Mohamed,Federal regulators are wielding a classic Warren Buffett concept to go after Apple — his biggest stock bet,"Warren Buffett popularized the idea of a competitive ""moat"" around a company. Regulators used the term eight times in their lawsuit against Apple.",https://www.businessinsider.com/warren-buffett-apple-stock-regulation-lawsuit-moat-competition-berkshire-hathaway-2024-3,https://i.insider.com/660447d51caec1275a69ebb8?width=1200&format=jpeg,2024-03-29 09:47:01+00:00,"The Department of Justice is suing Apple for monopolizing smartphone markets with the iPhone.

Regulators called Apple's defenses against its rivals a ""moat,"" borrowing Warren Buffett's metaphor.

Buffett's Berkshire Hathaway is one of Apple's biggest shareholders with a nearly 6% stake.

NEW LOOK Sign up to get the inside scoop on today’s biggest stories in markets, tech, and business — delivered daily. Read preview Thanks for signing up! Access your favorite topics in a personalized feed while you're on the go. download the app Email address Sign up By clicking “Sign Up”, you accept our Terms of Service and Privacy Policy . You can opt-out at any time.

Advertisement

The Department of Justice is suing Apple for monopolizing smartphone markets — and cheekily used a term coined by Warren Buffett to make its case against the investor's No. 1 stock.

Federal regulators used the word ""moat"" eight times in their civil antitrust complain to describe the defenses that Apple sets up to keep competitors at bay.

They alleged the iPhone maker ""built and reinforced"" a ""wide and deep"" moat around its ""smartphone monopoly,"" and said the company ""crushes innovation that might help fill in the moat.""

They also wrote that Apple's ""moat building has not resulted in lower prices, higher output, improved innovation, or a better user experience for smartphone users,"" although some may disagree.

Advertisement

Castles and moats

Buffett popularized the concept of a company having a ""moat"" around it that protects it from rivals.

The Berkshire Hathaway CEO has used the metaphor dozens of times in his yearly shareholder letters, and during his company's annual gatherings.

Here's what Buffett said about two of his favorite businesses, Coke and Gillette, in his 1993 letter:

""The might of their brand names, the attributes of their products, and the strength of their distribution systems give them an enormous competitive advantage, setting up a protective moat around their economic castles. The average company, in contrast, does battle daily without any such means of protection.""

Advertisement

The Berkshire CEO built on the idea in his 2007 letter:

""A truly great business must have an enduring 'moat' that protects excellent returns on invested capital. The dynamics of capitalism guarantee that competitors will repeatedly assault any business 'castle' that is earning high returns.

Therefore a formidable barrier such as a company's being the low-cost producer (GEICO, Costco) or possessing a powerful worldwide brand (Coca-Cola, Gillette, American Express) is essential for sustained success. Business history is filled with 'Roman Candles,' companies whose moats proved illusory and were soon crossed.""

The billionaire deployed the metaphor once again during Berkshire's 2017 meeting:

Advertisement

""If you've got a wonderful business, even if it's a small one like See's Candy, you basically have an economic castle. And in capitalism, people are going to try and take away that castle from you.

Related stories

So, you want a moat around it that can protect it. And then you want a knight in the castle that's pretty darn good at warding off marauders.""

Crocodiles, poison — and sand

Moats have been core to Buffett's investing philosophy for decades. He seeks to invest in businesses with ""unbreachable moats,"" he said in his 1995 letter.

His valuation process includes analyzing a company's moat, as it affects the certainty and size of its future cash flows, he said at the 1999 meeting.

Advertisement

The Berkshire chief also tells the managers of all of the conglomerate's subsidiaries to work relentlessly to widen their moats, he wrote in his 2012 letter.

He even defended moats at the 2018 meeting after Tesla CEO Elon Musk called them ""lame."" His response: ""I don't think he'd want to take us on in candy.""

Buffett is clearly passionate about moats, but he's still had some fun with the metaphor over the years. At the 2000 meeting, he praised See's CEO at the time for throwing ""crocodiles, and sharks, and piranhas in the moat"" as that made it ""harder for people to swim across and attack the castle.""

Moreover, he described Moody's moat as being ""far wider, deeper, and infested with far more poisonous characters.""

Advertisement

Buffett's late business partner, Charlie Munger, also chimed in during the 2009 meeting, bemoaning that ""a lot of moats have been filling up with sand lately.""

Regulators aren't moat fans

Buffett almost certainly evaluated the moat around Apple and the iPhone and liked what he saw, given he put about $36 billion into the tech titan between 2016 and 2018.

Berkshire's position has more than quadrupled in value to more than $150 billion, making Apple the top holding in Buffett's roughly $350 billion stock portfolio — while Berkshire's near-6% stake ranks it among Apple's largest shareholders.

Unsurprisingly, Buffett has loudly praised Apple in recent years. He's called it a ""better business than any we own,"" and hailed CEO Tim Cook as a world-class manager.

Advertisement

He's also underscored how indispensable the iPhone is by suggesting owners would probably turn down a $10,000 offer to never use the device again.

The iPhone is a big part of Apple's ""moat."" NurPhoto / Getty

The stickiness of Apple's product ecosystem, and how that staves off competition, may well have been a factor in Buffett's backing and high praise.

Yet regulators are accusing Apple of going too far in digging its moat. They've alleged it illegally excludes and deters competition by stopping its products from working well — or at all — with non-Apple devices and apps. Apple has argued that a so-called walled garden is more secure and allows a more consistent user experience.

While Buffett clearly sees moats as beneficial to a company and its investors, even he might admit they're not always good for consumers or for fostering innovation.

Advertisement

The Department of Justice has added insult to injury by not only targeting Buffett's biggest stock bet, but also wielding the investor's moat metaphor against him, at least indirectly."
