source,author,title,description,url,urlToImage,publishedAt,content
"{'id': 'fortune', 'name': 'Fortune'}","Scott Bauer, The Associated Press","Amazon drivers are workers, Wisconsin Supreme Court rules in closely watched case","The decision means an Amazon subsidiary, Amazon Logistics, will likely be hit with a tax bill of more than $200,000.",https://fortune.com/2024/03/26/amazon-delivery-drivers-workers-wisconsin-supreme-court/,"https://fortune.com/img-assets/wp-content/uploads/2024/03/AP24086509597620-e1711498241592.jpg?resize=1200,600",2024-03-27 00:15:15+00:00,"The Wisconsin Supreme Court on Tuesday let stand a lower court ruling that declared some delivery drivers for Amazon were employees as the state argued, not independent contractors as the online retail giant contended.

The court, in a unanimous decision, said the appeal was “improvidently granted,” meaning the Supreme Court should not have reviewed the case. That decision dismissing the case, issued after the court heard oral arguments, leaves a 2023 Wisconsin appeals court ruling against Amazon in place.

That ruling found that drivers in the Amazon Flex program are a part of the state’s unemployment insurance system and entitled to jobless pay if they are laid off. The decision means an Amazon subsidiary, Amazon Logistics, will likely be hit with a tax bill of more than $200,000.

Justice Ann Walsh Bradley, in a concurring decision, said the reason the court dismissed the case was that further review “would not serve any meaningful purpose” or any “further development of the law.” Justice Rebecca Bradley, in a separate writing, faulted Bradley for trying to explain the court’s decision, saying it “will only sow additional confusion.”

The case was closely watched for what effect a ruling would have on workers in the “gig economy.”

Amazon spokesperson Steve Kelly said the retailer was “disappointed that the Wisconsin Supreme Court declined to weigh in and provide much needed guidance on these matters and are determining our next steps.”

Labor unions, along with the state Department of Workforce Development, pushed for the Wisconsin Supreme Court to recognize the Amazon Flex workers as employees.

Stephanie Bloomingdale, president of the Wisconsin AFL-CIO, hailed the court’s action, calling it a “win for working people.”

“Far too often, especially in the emerging gig economy, big and powerful companies like Amazon use the misclassification of employees as independent contractors to deny working people essential workplace rights like minimum wages, overtime pay, and unemployment insurance,” she said.

Courts across the country have been grappling with similar questions as states struggle with how to treat workers who are hired for a particular job, often at the push of a button through a smartphone app, to deliver food, groceries, packages or perform a variety of tasks.

“The gig economy is clogging up the court with all of this stuff, all the time,” said Samantha Prince, assistant professor of law at Penn State Dickinson College of Law and an expert on worker misclassification and the gig economy. “It’s just nuts. We really need this stuff to be resolved and stay resolved and stop with all the uncertainty for everybody.”

Prince said the Wisconsin case “will likely resonate through the other gig company court cases.”

“The more cases that find that gig company drivers are employees, the more companies are going to have to pay their rightful share,” she said.

Every state has its own laws determining whether workers are employees or independent contractors, Prince said. Those laws set the rules for what wages and overtime the workers must be paid and, in this case, whether they are subject to unemployment benefits that the employer must contribute toward.

Employees who got approved for the Amazon Flex program could download an app for their personal phones showing blocks when they could deliver packages for the company. Workers would scan packages at the Amazon warehouse in Milwaukee and use their personal vehicles to deliver them, using a route suggested by Amazon.

After one Amazon Flex worker was fired, he filed for unemployment insurance. The Department of Workforce Development conducted an audit of more than 1,000 Amazon Logistics drivers between 2016 and 2018 and concluded the vast majority of drivers were employees, not independent contractors, and therefore eligible for unemployment insurance payments. The state told Amazon in 2018 that it owed more than $205,000 in unemployment insurance premiums.

The Wisconsin Labor and Industry Review Commission upheld the state DWD determination that the drivers were employees. Amazon Logistics sued and a Waukesha County circuit court judge ruled the drivers were independent contractors. Last year, the Wisconsin Court of Appeals overturned that ruling, agreeing with the state that the drivers were employees. That set up the appeal to the Wisconsin Supreme Court.

Many other states have looked at the issue.

A Virginia appeals court ruled in 2023 that Amazon Flex drivers were employees, not independent contractors, and ordered Amazon to pay unemployment insurance taxes and penalties.

A California state appeals court last year said app-based ride-hailing and delivery companies like Uber and Lyft can continue to treat their California drivers as independent contractors, allowing them to bypass other state laws requiring worker protections and benefits.

The U.S. Department of Labor enacted a new rule March 11 that aims to prevent the misclassification of workers as “independent contractors,” a step that could bolster both legal protections and compensation for millions in the U.S. workforce. That rule applies to wages and overtime, but not unemployment compensation."
"{'id': 'business-insider', 'name': 'Business Insider'}",mberg@businessinsider.com (Madeline Berg),What yachting industry insiders have to say about Jeff Bezos' superyacht,"Amazon founder Jeff Bezos' superyacht Koru, which cost a reported $500 million to build, was a big topic of conversation at the Palm Beach boat show.",https://www.businessinsider.com/jeff-bezos-yacht-superyacht-koru-beautiful-amazing-insiders-say-2024-3,https://i.insider.com/66023de416bde8d4ead20fb0?width=1200&format=jpeg,2024-03-27 09:00:02+00:00,"Jeff Bezos' yacht, which reportedly cost $500 million to build, completed its first year at sea.

The superyacht, Koru, was a frequent topic of conversation at the Palm Beach boat show.

Here's what industry insiders think about the vessel.

NEW LOOK Sign up to get the inside scoop on today’s biggest stories in markets, tech, and business — delivered daily. Read preview Thanks for signing up! Access your favorite topics in a personalized feed while you're on the go. download the app Email address Sign up By clicking “Sign Up”, you accept our Terms of Service and Privacy Policy . You can opt-out at any time.

Advertisement

It's been just about a year since Koru, Jeff Bezos' $500 million megayacht, set sail from the Oceanco shipyard in the Netherlands, capturing the attention of yachting insiders and land dwellers alike.

Even after her first season at sea, the 127-meter ship is still one of the most talked about vessels among those in the know — and not just for the busty figurehead on its prow, which many have wrongly speculated is based on Bezos's fiancée. Koru was a hot topic at the annual Palm Beach International Boat Show, where the yachts of other billionaires were on display for sale or charter.

The overwhelming response from those Business Insider spoke to was awe, with many praising her unique design, commenting on her immense size, or remarking that they'd been lucky enough to see her up close.

""It's absolutely beautiful,"" said Federico Rossi, the COO of luxury yachtbuilder Rossinavi.

Advertisement

Still, due to the small size of the industry — and the fact that privacy is paramount in the yachting community — even those who complimented Koru mostly did not want to go on record in order to protect professional relationships.

""That thing's amazing,"" one such superyacht expert told BI. ""It's very well done in terms of craftsmanship.""

Unlike many other megayachts, Koru, which media billionaire Barry Diller's Eos inspired, is designed as a sailing yacht. That bucks the current trend of more severe-looking explorer boats — though Koru's 75-meter support vessel Abeona is of a more typical style,

""I heard back in 2018 or something that somebody had ordered a classic sailing yacht,"" the superyacht expert also told BI. ""You order 125 meters, that's not really going to be classic. But it is. I think it's pretty cool.""

Advertisement

Like most other megayachts, Koru is powered by her engines, which are reportedly innovative in their use of a kinetic energy recovery system. Industry experts, therefore, pointed out that her sails are more for looks than anything else — but that still works in her favor, with many praising her overall aesthetic appeal.

Related stories

""It's stunning,"" added a captain who has worked on several megayachts. He said he'd seen Koru in St. Barts, a favorite spot of Bezos and his fiancée Lauren Sanchez, over the holidays.

""There are definitely uglier boats out there,"" one yacht architect said. ""It's not like it's shaped like his rocket,"" he jokily added, referring to the phallic design of Blue Origin's New Shephard.

The yacht, which was used frequently by Bezos and Lauren Sanchez last summer, is hard to miss given its unique style — and its sheer size. MEGA/GC Images

Some, though, think the yacht is a bit excessive — which is saying something in a world where bigger is better and $250 million is a normal amount to spend.

Advertisement

""That's over the top. That's an insanely ridiculous boat,"" a longtime broker who favors discretion said. It's a ""whole big show.""

And the expert who praised the yacht's craftsmanship balanced his admiring comments by saying Koru's liberal use of teak — a wood traditionally used for yacht decks — was ""bizarre.""

The material has gained a bad reputation in the industry in recent years, as it typically comes from Myanmar, a country with a checkered human rights record. Plus, it takes a long time to grow, leading to deforestation.

Many shipyards have now turned to alternatives, like bamboo or plantation-grown teak, in their pushes toward sustainability. Bezos' team did not respond to BI's question about the origin of the deck's wood.

Advertisement

Teak or not, the yachting industry isn't generally known for being all that environmentally friendly — or indeed lowkey, so many who BI talked to didn't buy into the idea that Koru is ""too much.""

""If this is genuinely Jeff's dream come true, then great,"" Anders Kurtén, the CEO of brokerage Fraser Yachts, said. ""I'm genuinely happy for him, and I'm happy for the people who got the opportunity to have employment to work on that.""

And Bezos, of course, isn't the only billionaire with a stunning yacht. Billionaires like Jerry Jones and Bernard Arnault have also, at times, turned heads with their boats.

Most recently, insiders have tied Mark Zuckerberg to a 118-meter ship named Launchpad. It's the latest superyacht to capture the yachting world's attention.

Advertisement

So, as she sets sail for her debut summer season, Launchpad may take Koru's place as the main yacht on everyone's radar this year."
"{'id': 'financial-post', 'name': 'Financial Post'}",Bloomberg News,Amazon Says Japan Isn’t Meeting Corporate Needs for Clean Power,Japan still relies on fossil fuels to generate more than 70% of its power.,https://financialpost.com/pmn/business-pmn/amazon-says-japan-isnt-meeting-corporate-needs-for-clean-power,https://smartcdn.gprod.postmedia.digital/financialpost/wp-content/uploads/2024/03/share-of-renewable-electricity-japan-had-the-lowest-share-o.jpg,2024-03-27 23:04:08+00:00,"This advertisement has not loaded yet, but your article continues below.

Amazon Says Japan Isn't Meeting Corporate Needs for Clean Power Japan still relies on fossil fuels to generate more than 70% of its power. Source: RE100

Article content (Bloomberg) — Amazon.com Inc., the world’s biggest corporate buyer of clean electricity, delivered a clear verdict on Japan’s energy policy earlier this month: The country isn’t moving quickly enough to deliver green power to the private sector. We apologize, but this video has failed to load.

tap here to see other videos from our team. Try refreshing your browser, or Amazon Says Japan Isn't Meeting Corporate Needs for Clean Power Back to video “If a company with Amazon’s scale cannot procure power at scale in Japan, then there’s something wrong with how we’re enabling new projects to come online quickly enough to meet the demand that’s growing,” Ken Haig, head of energy and environmental policy for the Asia-Pacific region for Amazon Web Services said at a Renewable Energy Institute conference in Tokyo. “There are many, many companies looking for renewable power here in Japan. We need more supply to meet that demand.”

Advertisement 2 Story continues below This advertisement has not loaded yet, but your article continues below.

THIS CONTENT IS RESERVED FOR SUBSCRIBERS ONLY Subscribe now to read the latest news in your city and across Canada. Exclusive articles from Barbara Shecter, Joe O'Connor, Gabriel Friedman, Victoria Wells and others.

Daily content from Financial Times, the world's leading global business publication.

Unlimited online access to read articles from Financial Post, National Post and 15 news sites across Canada with one account.

National Post ePaper, an electronic replica of the print edition to view on any device, share and comment on.

Daily puzzles, including the New York Times Crossword. SUBSCRIBE TO UNLOCK MORE ARTICLES Subscribe now to read the latest news in your city and across Canada. Exclusive articles from Barbara Shecter, Joe O'Connor, Gabriel Friedman, Victoria Wells and others.

Daily content from Financial Times, the world's leading global business publication.

Unlimited online access to read articles from Financial Post, National Post and 15 news sites across Canada with one account.

National Post ePaper, an electronic replica of the print edition to view on any device, share and comment on.

Daily puzzles, including the New York Times Crossword. REGISTER / SIGN IN TO UNLOCK MORE ARTICLES Create an account or sign in to continue with your reading experience. Access articles from across Canada with one account.

Share your thoughts and join the conversation in the comments.

Enjoy additional articles per month.

Get email updates from your favourite authors. Sign In or Create an Account Email Address Continue or View more offers

Article content

Article content Japan has become a difficult market for companies that need green electricity to meet internal emissions targets and customer demands. The country currently relies on fossil fuels for more than 70% of its power generation, and while it committed along with the rest of the world at COP28 in Dubai in December to tripling global renewable capacity by 2030, the country plans to keep burning coal, oil and gas for much of its electricity. The government is making the utmost effort to make renewable energy the main source of power, the New and Renewable Energy Division within Japan’s Agency for Natural Resources and Energy said in a statement. A group of more than 400 global firms has been calling on Japan since 2021 to increase its investments in renewable energy, so that clean power could make up roughly half of the energy mix by 2030, from a target of around 38% by the end of this decade. That strategy is typically reviewed every three years or so and the government is expected to revisit it starting this year. In 2022, RE100 companies were able to meet 25% of their demand for electricity in Japan from renewable sources, lower than the global average of 50%.

Top Stories Get the latest headlines, breaking news and columns. There was an error, please provide a valid email address. Sign Up By signing up you consent to receive the above newsletter from Postmedia Network Inc. Thanks for signing up! A welcome email is on its way. If you don't see it, please check your junk folder. The next issue of Top Stories will soon be in your inbox. We encountered an issue signing you up. Please try again

Article content

Advertisement 3 Story continues below This advertisement has not loaded yet, but your article continues below.

Article content Japan’s energy policymakers say that the country’s mountainous terrain and relative isolation as an island nation make it more difficult and costly to develop renewable energy at scale. At the same time, the country’s power grid remains isolated, a legacy of Japan’s 10 major regional utility monopolies, making it difficult to get renewable power to where it can be used. Japan is leaning heavily on future technologies like carbon capture and storage, or co-firing of ammonia or hydrogen, to reduce the CO2 emissions generated by fossil fuels, but that doesn’t meet the needs of companies committed to renewable energy now. Amazon has announced more than 500 renewable energy projects globally, although Haig emphasized it’s difficult for the company to procure clean electricity across Asia. A power purchase agreement signed in 2022 with Indonesia’s state utility Perusahaan Listrik Negara to buy clean electricity from a solar project is bigger than the cumulative amount of power Amazon has been able to procure in Japan, he said. “It’s very hard for us to purchase renewable power in this part of the world,” he said referring to Asia. “We’re trying to fix that. It’s not a technology problem, it’s a policy and market problem.”

Advertisement 4 Story continues below This advertisement has not loaded yet, but your article continues below.

Article content Japan has announced a plan to invest more than 150 trillion yen ($990 billion) in public and private money for so-called green transformation, which includes 31 trillion yen for renewables, the second-largest allocation after automotive. But climate analysts say the nation needs to do more. Spending allocations from the debt instrument are misaligned with the Intergovernmental Panel on Climate Change’s guidance on limiting the rise in global temperatures, climate research group InfluenceMap said in November. Global companies with operations in Japan as well as domestic firms have renewable targets they are aiming to make by 2030 but insufficient supplies are jeopardizing those goals, said Kahori Miyake, co-chair of Japan Climate Leaders Partnership, which partners with the RE100. “We’re trying as much as possible as individual companies but the total amount of clean energy that is available in Japan is just not enough at the moment,” said Miyake.

Article content

Share this article in your social network

Read Next"
"{'id': 'fortune', 'name': 'Fortune'}","Matt Day, Rachel Metz, Bloomberg",Amazon injects another $2.75 billion into startup founded by siblings who worked at OpenAI,"The startup, Anthropic, has become one of OpenAI’s most formidable competitors.",https://fortune.com/2024/03/27/amazon-siblings-openai/,"https://fortune.com/img-assets/wp-content/uploads/2024/03/GettyImages-1692539711-e1711588253893.jpg?resize=1200,600",2024-03-28 01:13:26+00:00,"Amazon.com Inc. says it’s investing an additional $2.75 billion in Anthropic, completing a deal it made last year to back the artificial intelligence startup and expand a partnership between the companies.

The infusion brings Amazon’s total investment in Anthropic, a well-regarded builder of AI tools able to generate text and analysis, to $4 billion, following an earlier investment announced in September. As part of that deal, Amazon had the right to contribute the additional funds in the form of a convertible note, provided it did so before the end of March.

As part of the tie-up, Anthropic has also agreed to use Amazon Web Services data centers to power some of its operations, and to use Amazon’s custom-built computer chips. Anthropic, based in San Francisco, has also committed to using chips from Alphabet Inc.’s Google, another close partner.

Anthropic is tied up with multiple big tech companies, including Google, which joined a $450 million round of financing last May led by Spark Capital. Google and Amazon Web Services are both Anthropic’s cloud computing partners.

Anthropic was formed in 2021 by former employees of OpenAI, including Daniela Amodei and her brother Dario, who serves as its chief executive officer. The company has since become one of OpenAI’s most formidable competitors, raising billions in funding. Most of its customers are businesses, ranging from search engine DuckDuckGo to travel guide publisher Lonely Planet.

The company, which offers a chatbot named Claude, has emphasized developing AI safely and responsibly. In early March, it introduced new software for the chatbot that it said will be better at carrying out complicated instructions and less prone to making things up.

Chatbots capable of mimicking human conversation have become an increasing focus of Silicon Valley companies — with fast tech advances fueling an investing frenzy. Chatbots themselves are by no means new. But the technology powering Claude and competitors’ bots is a more powerful tool known as a large language model, which is trained on massive swaths of the internet in order to generate text, such as an answer to a question or a poem. Such tools are an application of generative AI, systems that consider input such as a text prompt and use it to output new content."
