source,author,title,description,url,urlToImage,publishedAt,content
"{'id': 'financial-post', 'name': 'Financial Post'}",Business Wire,Mavenir Digital BSS Now Available on Amazon Web Services Marketplace,"RICHARDSON, Texas — Mavenir, the cloud-native network infrastructure provider building the future of networks, today announces that the Mavenir Digital Enablement (MDE) is now available on Amazon Web Services (AWS) Marketplace. Mavenir’s Digital Enablement (M…",https://financialpost.com/pmn/business-wire-news-releases-pmn/mavenir-digital-bss-now-available-on-amazon-web-services-marketplace,,2024-04-16 11:04:52+00:00,"Mavenir’s Digital Enablement (MDE) Business Support System (BSS) stack with composable architecture allows Communication Service Providers (CSPs) to implement innovative strategies and new selling models quickly, cost-effectively and with minimal risk, with the ability to test models iteratively and speed time-to-market without increasing capital and resource costs. MDE’s comprehensive set of modules already run on AWS – for reduced application-to-infrastructure test times – and span customer management, product catalog, order management, CRM, billing, converged charging, API monetization and network slice charging. With low-code/no-code visual builders and templated solutions-in-a-box, MDE is now available as a one-stop destination and digital marketplace for CSPs looking to implement new or complex models simply and agilely.

RICHARDSON, Texas — Mavenir, the cloud-native network infrastructure provider building the future of networks, today announces that the Mavenir Digital Enablement (MDE) is now available on Amazon Web Services (AWS) Marketplace .

This advertisement has not loaded yet, but your article continues below.

Subscribe now to read the latest news in your city and across Canada.

Subscribe now to read the latest news in your city and across Canada.

Article content

MDE offers a low-risk route to introducing profitable new business models such as split or sponsored billing, new package product offerings incorporating third-party solutions, automation for inter-partner manual tasks such as catalog mapping, and notifications mapping for service delivery to improve operational efficiency and the customer experience.

Mavenir’s Digital BSS has achieved platinum certification from TM Forum, with open APIs ensuring seamless integration with existing or new third-party systems and eliminating the need for resource-intensive system integration effort.

Sandeep Singh, Senior Vice President and General Manager for Mavenir’s Digital Business Enablement commented: “Mavenir’s Digital BSS is a transformative solution for service providers looking to stay ahead of the competition and launch innovative offerings in a fast time-to-market. Our arrival on AWS Marketplace is a strategic acceleration of our mission to drive sustainable global network automation and monetization, empowering the world’s operators to roll out advanced digital experiences at scale.”

He added: “By facilitating end-to-end digitization of customer interactions and streamlining collaboration with third-party partners – all within a stable and agile architecture – MDE Digital BSS provides service providers with a complete innovation framework to create seamless, personalized network service experiences for customers, and realize the gains with flexible monetization capabilities.”

John Abraham, Principal Analyst, Appledore Research noted: “One of the main innovation barriers for CSPs is the inflexibility of incumbent legacy BSS ecosystems, which require substantial investment in time, cost, and operational resources to enable new revenue models and service capabilities. Simplifying the path to the timely introduction of new business models and innovative best practices, as Mavenir is enabling with its MDE solution, provides CSPs with a distinct advantage in time to market and TCO.”

The MDE platform not only enables greenfield service providers to bring new services to market rapidly but also empowers brownfield service providers to modernize their legacy stack, accelerate digital transformation, and provides a viable path to migrate to 5G while co-existing with existing technologies (2G/3G/4G). MDE brings marketplace capabilities to service providers to cross sell 3rd Party Partner-led product and services integrated with CSPs and Mobile Virtual Network Operators (MVNOs) worldwide. The platform uses advanced AI-ML engines to derive intelligence from customer and network data, which is then used to recommend new products based on historical behavior, and also delivers categorization capabilities that enable service providers to fully capitalize on their rich datasets – bringing new revenues and boosting customer stickiness."
"{'id': 'financial-post', 'name': 'Financial Post'}",Bloomberg News,Microsoft’s AI Copilot Is Starting to Automate the Coding Industry,The assistant is saving engineers hundreds of hours a month and is helping GitHub retain its edge over rivals including Amazon and Google.,https://financialpost.com/pmn/business-pmn/microsofts-ai-copilot-is-starting-to-automate-the-coding-industry,https://smartcdn.gprod.postmedia.digital/financialpost/wp-content/uploads/2024/04/github-copilot-top-pick-for-coders-a-survey-asked-developer.jpg,2024-04-17 09:20:05+00:00,"This advertisement has not loaded yet, but your article continues below.

Microsoft's AI Copilot Is Starting to Automate the Coding Industry The assistant is saving engineers hundreds of hours a month and is helping GitHub retain its edge over rivals including Amazon and Google. Source: Stack Overflow 2023 Deve

Article content (Bloomberg) — When software developer Nikolai Avteniev got his hands on a preview version of Microsoft Corp.’s Copilot coding assistant in 2021, he quickly saw the potential. We apologize, but this video has failed to load.

tap here to see other videos from our team. Try refreshing your browser, or Microsoft's AI Copilot Is Starting to Automate the Coding Industry Back to video Developed by Microsoft’s GitHub coding platform and based on a version of OpenAI’s generative artificial intelligence, the assistant wasn’t perfect and sometimes got things wrong. But Avteniev, who works for ticket seller StubHub, was surprised by how ably it finished lines of code with just a few prompts. All he had to do was press the tab key, and Copilot filled in the rest.

Advertisement 2 Story continues below This advertisement has not loaded yet, but your article continues below.

THIS CONTENT IS RESERVED FOR SUBSCRIBERS ONLY Subscribe now to read the latest news in your city and across Canada. Exclusive articles from Barbara Shecter, Joe O'Connor, Gabriel Friedman, Victoria Wells and others.

Daily content from Financial Times, the world's leading global business publication.

Unlimited online access to read articles from Financial Post, National Post and 15 news sites across Canada with one account.

National Post ePaper, an electronic replica of the print edition to view on any device, share and comment on.

Daily puzzles, including the New York Times Crossword. SUBSCRIBE TO UNLOCK MORE ARTICLES Subscribe now to read the latest news in your city and across Canada. Exclusive articles from Barbara Shecter, Joe O'Connor, Gabriel Friedman, Victoria Wells and others.

Daily content from Financial Times, the world's leading global business publication.

Unlimited online access to read articles from Financial Post, National Post and 15 news sites across Canada with one account.

National Post ePaper, an electronic replica of the print edition to view on any device, share and comment on.

Daily puzzles, including the New York Times Crossword. REGISTER / SIGN IN TO UNLOCK MORE ARTICLES Create an account or sign in to continue with your reading experience. Access articles from across Canada with one account.

Share your thoughts and join the conversation in the comments.

Enjoy additional articles per month.

Get email updates from your favourite authors. Sign In or Create an Account Email Address Continue or View more offers

Article content

Article content “Instead of using 15 keystrokes, it took three,” he recalled recently. “It was nice a little speed boost.” Three years later, and now infused with the latest version of OpenAI’s GPT-4 technology, GitHub’s Copilot can do a lot more, including answering engineers’ questions and converting code from one programming language to another. As a result, the assistant is responsible for an increasingly significant percentage of the software being written and is even being used to program corporations’ critical systems. Along the way, Copilot is gradually revolutionizing the working lives of software engineers—the first professional cohort to use generative AI en masse. Microsoft says Copilot has attracted 1.3 million customers so far, including 50,000 businesses ranging from small startups to corporations like Goldman Sachs, Ford and Ernst & Young. Engineers say Copilot saves them hundreds of hours a month by handling tedious and repetitive tasks, affording them time to focus on knottier challenges. Acquired by Microsoft in 2018 for $7.5 billion, GitHub dominates its market and is betting Copilot has the AI horsepower to fight off rival services including Tabnine, Amazon’s CodeWhisperer and Google-backed Replit Ghostwriter. GitHub’s AI assistant is also a kind of beta test for a host of other Copilots that Microsoft is baking into Office, Windows, Bing and other business lines.

Top Stories Get the latest headlines, breaking news and columns. There was an error, please provide a valid email address. Sign Up By signing up you consent to receive the above newsletter from Postmedia Network Inc. Thanks for signing up! A welcome email is on its way. If you don't see it, please check your junk folder. The next issue of Top Stories will soon be in your inbox. We encountered an issue signing you up. Please try again

Article content

Advertisement 3 Story continues below This advertisement has not loaded yet, but your article continues below.

Article content As is true with AI generally, GitHub Copilot has limitations. Developers say it sometimes pulls up outdated code, provides unhelpful answers to questions and generates suggestions that are buggy or could infringe copyright. Because the tool is trained on public and open repositories of code, engineers run the risk of replicating security issues or injecting new ones into their work, particularly if they blindly accept Copilot’s recommendations. GitHub emphasizes that the tool is an assistant, not a substitute for human programmers, and has put the onus on customers to use it wisely. Robust guidelines are required to prevent lazy programmers from simply accepting what Copilot suggests, said GitHub Chief Executive Officer Thomas Dohmke. He expressed confidence that engineers would keep one another honest. “The social dynamic of the team will make sure that those that are cheating by accepting code too fast and that don’t actually go through the process defined by the team, that code will not make it into production,” he said in an interview. Generative AI is the latest in a long line of innovations that have transformed computer coding over the years. Last century, program compilers accelerated software development by rapidly translating commands into ones and zeros that computers can understand. More recently, Linux popularized open-source coding, letting programmers leverage one another’s work rather than writing everything from scratch.

Advertisement 4 Story continues below This advertisement has not loaded yet, but your article continues below.

Article content Coding assistants like GitHub’s Copilot could be even more revolutionary because generative AI holds the potential power to automate large swathes of what software engineers currently do. For now, it mostly makes them more efficient. StubHub’s Avteniev, who also teaches software engineering at City College of New York, says Copilot’s predictive ability helps programmers stay in “the flow” because they no longer have to stop to look things up. Avteniev has been coding for more than 20 years, but even he sometimes forgets programming languages—forcing him to waste time Googling them. “Copilot stops you from having to exit your current coding process,” he said. “Even when it produces gibberish, it’s still easier to just accept what it does and then correct it myself.” Aaron Hedges, a developer for more than 15 years, was getting burned out before Copilot arrived. Hedges works for ReadMe, a startup that helps companies create technical descriptions of their application programming interfaces, or APIs. Like Avteniev, he makes good use of Copilot’s auto-complete function. “Because I’m a fairly senior engineer, I can look at that and go, ‘Oh yeah, that looks right.’” He also likes that he can ask questions without leaving his programming window. “I don’t have to shift away and open a browser, which can be really disruptive,” he said.

Advertisement 5 Story continues below This advertisement has not loaded yet, but your article continues below.

Article content At $10 a month, a Copilot subscription is a bargain that Hedges willingly pays himself. After work, he builds websites for Dungeons & Dragons fans. With a toddler and another baby on the way, leisure time is precious. “Those two hours I get to myself to code in the evening are super important to me,” he said. “The more efficient I can be, the better.” Few tasks are more tedious than debugging software—a process that can consume as much as 50% of an engineer’s time. Figma, which helps developers design app or website interfaces, says Copilot can create defect-testing programs in minutes rather than hours. “That is the real value of AI,” said Abhishek Mathur, the company’s vice president of engineering. “It doesn’t replace our work, but frees up our time to develop creative solutions.” Some companies are starting to deploy Copilot to create code for critical systems. Brewer Carlsberg uses it to write code for an existing tool that helps the sales force plan, prepare for and document sales calls. Mindful of Copilot’s limitations, the beer maker uses its own quality-assurance process to check that the code it has created works as intended, according to Chief Information Officer Sarah Haywood. Eventually, she said, companies will be able to outsource that task as well. “As time goes on, people will build more trust in AI,” she said. “I don’t think we should be having to double-check everything that AI does, otherwise we’re not really adding any value.”

Advertisement 6 Story continues below This advertisement has not loaded yet, but your article continues below.

Article content In an attempt to assess the technology’s accuracy, Canada’s University of Waterloo published an experiment last year. Researchers collected a dataset made up of code snippets that had known flaws and the fixes for those mistakes. The researchers prompted Copilot to create these exact snippets to see whether it would spit out the buggy versions. The assistant replicated the flawed version 33% of the time, less frequently than a human. In a quarter of the cases, the AI spit out code with the fix. Copilot generally was better at avoiding basic errors than more complex ones, said Mei Nagappan, a computer science professor at the school and one of the study’s authors. “The analogy here is that we are in an era of driver assist right now, not yet at the self-driving stage,” he said. Software engineers can be slow to change their work habits. Many welcome Copilot but are wary about becoming too reliant on it. A recent GitHub-funded study found developers accepted the assistant’s suggestions just 27% of the time. Engineers also can be quick to blame Copilot if something goes awry. When Etsy’s site crashed for short periods last October and December, some of the company’s developers fingered Copilot for the outage. Etsy confirmed the incidents but disputed that Copilot was responsible. “While we certainly understand that engineers may discuss how Copilot could theoretically play a role in outages or issues, we have zero evidence that the tool has actually led to any customer-facing impacts,” a spokesperson said.

Advertisement 7 Story continues below This advertisement has not loaded yet, but your article continues below.

Article content Copilot is expected to improve dramatically in the coming years. GitHub is already rolling out enhancements, including an enterprise version that can answer questions based on a customer’s own programming code, which should help new engineers get up to speed and enable veteran coders to work faster. In the coming months, GitHub also will let engineers use their employer’s own codebase to help auto-complete programs they’re working on. That will make the code generated more customized and helpful. GitHub can’t afford to sit still. At least a dozen startups are looking to disrupt the market. Some are leveraging new models that have dramatically boosted the amount of information code assistants can draw on quickly, making it easier for them to generate entire programs. “An AI programmer that can see all of your code is going to be able to make much better decisions and write much more coherent code than one that can only sort of look at your code through a paper towel roll, a small amount at time,” said Nat Friedman, an investor and former GitHub CEO. Friedman is backing a startup called Magic AI that plans to create “a superhuman software engineer.” Peter Thiel-backed Cognition AI, meanwhile, is working on an assistant that can handle software projects on its own. Princeton University this month released an open-source model for an AI software engineering agent, and it seems that not a week goes by without a new startup popping up. In interviews, few coders expressed fears that AI will replace them. As in many industries, they say, automation will free them up to focus on more challenging and interesting tasks. But Jensen Huang, CEO of the red-hot AI chipmaker Nvidia Corp., has a less-rosy perspective. He recently predicted that coding as a career is doomed. Now that AI is making it possible to code in plain English, Huang said, anyone can become a programmer.

Article content

Share this article in your social network

Read Next"
