source,author,title,description,url,urlToImage,publishedAt,content
"{'id': 'fortune', 'name': 'Fortune'}","Matt Day, Bloomberg",Amazon is removing its cashierless Just Walk Out system from its Fresh grocery stores,The grocery business has struggled to build market share in an industry dominated by the likes of Walmart and Kroger.,https://fortune.com/2024/04/03/amazon-removing-cashierless-just-walk-out-system-fresh-grocery-stores/,"https://fortune.com/img-assets/wp-content/uploads/2024/04/GettyImages-1574691924-e1712135219458.jpg?resize=1200,600",2024-04-03 09:08:54+00:00,"Amazon.com Inc. is removing its cashierless Just Walk Out system from grocery stores, a retreat from an ambitious technology designed to let shoppers skip the line.

Amazon will pull the system as it remodels existing Fresh grocery stores and won’t feature it in new locations that will start opening later this year, an Amazon spokesperson said.

Tony Hoggett, Amazon’s senior vice president of grocery stores, joined the company in 2022 and launched a far-reaching revamp of the grocery business, which has struggled to build market share in an industry dominated by the likes of Walmart Inc. and Kroger Co.

Amazon plans to rely more heavily on its Dash Cart, which lets shoppers scan items as they go. But the company has dialed back the complexity of the technology.

The carts initially used a set of cameras to automatically identify what shoppers had grabbed from the shelf. Newer versions stripped out some cameras, and shoppers are now asked to hold the item in front of a pair of scanners, which can read bar codes among other cues. Shoppers can also use a touchscreen to ring up merchandise, such as produce, that lacks bar codes.

The Information reported the scrapping of Just Walk Out technology earlier.

The system uses ceiling-mounted cameras and shelf sensors, backed by algorithms, to determine what a shopper took from a store. Customers are charged automatically upon exiting.

The company began developing the technology more than a decade ago, part of a push by Jeff Bezos, then chief executive officer, to develop a unique offering to accompany Amazon’s move into physical stores.

The technology debuted in 2018 with the opening of a convenience store in the lobby of Amazon’s Seattle headquarters. The company built dozens of Amazon Go branded convenience stores and later installed the cashierless system in Fresh Stores and a pair of Whole Foods Market locations.

The technology alienated some shoppers, who were put off by entry gates or the feeling that Amazon had turned a visit to the grocery store into a high-tech vending machine. Receipts, which arrived digitally a few minutes to hours after a shopper checked out, also weren’t practical for big shops.

Amazon Go stores will still use Just Walk Out technology, and the company will continue to license it to other retailers. Smaller stores in the UK also will keep using the system."
"{'id': 'fortune', 'name': 'Fortune'}",Eleanor Pringle,Taylor Swift and OpenAI’s Sam Altman join the ranks of freshly minted billionaires,"LVMH founder Bernard Arnault, Tesla CEO Elon Musk, Amazon founder Jeff Bezos, and Meta founder Mark Zuckerberg make up the richest people in the world.",https://fortune.com/2024/04/03/taylor-swift-sam-altman-net-worth-billionaires/,"https://fortune.com/img-assets/wp-content/uploads/2024/04/Copy-of-FeatTemplate-43.jpg?resize=1200,600",2024-04-03 10:16:17+00:00,"More than 260 new names have made it onto the list of the world’s billionaires, Forbes has revealed, with both Taylor Swift and OpenAI CEO Sam Altman making an appearance for the first time.

The new rankings also confirmed Tesla CEO Elon Musk once again lags behind luxury goods titan Bernard Arnault in the race to be the richest person on earth.

The 75-year-old French kingpin Arnault, who oversees fashion empire LVMH with a net worth of $233 billion, led the record-breaking pack of 2,781 billionaires—more than ever before.

Moreover, the report found that 14 people are now centibillionaires with 12-figure fortunes.

Who are the world’s richest people?

Behind Arnault and X owner Musk—who has a fortune of $195 billion—are Amazon founder Jeff Bezos ($194 billion), Meta founder Mark Zuckerberg ($177 billion), and Oracle cofounder Larry Ellison ($141 billion).

Further down the top 10 are Berkshire Hathaway CEO Warren Buffett ($133 billion), Microsoft duo Bill Gates ($128 billion) and Steve Ballmer ($121 billion), Asia’s richest person Mukesh Ambani ($116 billion), and Google founder Larry Page ($114 billion).

And while the forerunners are made up of well-known faces, a host of new individuals also made it onto the list.

Swift’s Eras Tour propelled her to a net worth of $1.1 billion, while OpenAI’s CEO Altman also appeared courtesy of $1 billion in wealth.

Altman’s wealth isn’t made up of a stake in the company he runs—he has repeatedly said that he does not own equity in the company.

Rather, much of his traceable wealth is in a web of VC funds and startup investments, which is set to grow with the initial public offering of Reddit, where he’s among the largest shareholders.

The list’s youngest name—and appearing for the first time—is 19-year-old heiress Livia Voigt, who has inherited a $1.1 billion fortune courtesy of stakes in Brazilian wind manufacturer WEG, which was founded by her grandfather.

And despite a reported slowdown in luxury goods sales, fashion designer Christian Louboutin made it into the rankings with a net wealth of $1.2 billion.

America prevailed as home to the world's richest people, boasting a record 813 individuals with a combined wealth of $5.7 trillion.

Coming second: China and Hong Kong, with 473 individuals worth $1.7 trillion.

India ranks third with $954 billion across 200 individuals on the list.

“It’s been an amazing year for the world’s richest people, with more billionaires around the world than ever before,” said Chase Peterson-Withorn, Forbes senior editor, wealth. “Even during times of financial uncertainty for many, the super-rich continue to thrive.”

It's worth noting that Forbes's annual list does differ in its rankings from the likes of the Bloomberg Billionaires Index, which also places Arnault in the number one spot followed by Bezos.

Musk comes in third, followed by Zuckerberg, Gates, and Ballmer—though the net wealth of the majority differs between the two rankings.

How did Taylor Swift make her billion?

Swift, now a 14-time Grammy award winner, has had a stratospheric 12 months courtesy of her global tour which was the first ever to gross more than $1 billion.

Demand for tickets was so high that Ticketmaster experienced a raft of glitches and technical problems, with the fiasco ending in the cancellation of a public sale for the spots.

Fans traveled from far and wide to see the 34-year-old songstress in action, with research firm QuestionPro finding Swift will add a total of $4.6 billion to the U.S. economy courtesy of consumers spending on meals out, merch, and overnight stays.

As well as live shows, Swift also has a massive catalog of music, estimated by Bloomberg to be worth $400 million since 2019 alone.

This includes the re-releases of albums such as Fearless and 1989, which Swift re-recorded after her masters were sold to music mogul and manager, Scooter Braun.

According to Bloomberg, Swift's earnings from Spotify and YouTube total around $120 million while royalties from music sales rake in another $80 million.

The Pennsylvania-born songwriter and actress also owns property worth a reported $110 million per Bloomberg, with the New York Post listing her assets across a Tribeca townhouse with an attached apartment for security, an eight-bed mansion in Rhode Island, and a penthouse in Nashville.

Also in her portfolio is a four-bedroom Nashville complex with an adjacent guest house, as well as a seven-bedroom home in LA.

Swift is one of a small but powerful group of women on Forbes's rich list.

While women make up just 13% of the world's billionaires, their wealth is growing.

L’Oréal heiress Françoise Bettencourt Meyers's wealth jumped $19 billion since last year's list to $99.5 billion while MacKenzie Scott, Jeff Bezos's ex-wife, is up $11.2 billion from last year to $35.6 billion.

That's despite giving away millions following an ""open call"" to charities and organizations in need of support."
"{'id': 'fortune', 'name': 'Fortune'}","Lucas Shaw, Ashley Carman, Bloomberg",Spotify follows Apple and Amazon as it plans to raise prices and offer new plans to customers,"The higher prices will help cover the cost of audiobooks, a popular service introduced late last year.",https://fortune.com/europe/2024/04/03/spotify-apple-amazon-raise-prices-new-plans-customers/,"https://fortune.com/img-assets/wp-content/uploads/2024/04/GettyImages-1500013882-e1712152249565.jpg?resize=1200,600",2024-04-03 14:01:14+00:00,"Spotify Technology SA plans to raise the price of its popular audio service in several key markets for the second time in a year, a crucial step toward reaching long-term profitability.

The streaming giant will increase prices by about $1 to $2 a month in five markets by the end of April, including the UK, Australia and Pakistan, according to people familiar with the matter. It will raise prices in the US, its largest territory, later this year, said the people, who asked not to be identified discussing confidential plans.

Spotify shares jumped 4.6% to $281.92 at 9:35 a.m. in New York.

The higher prices will help cover the cost of audiobooks, a popular service introduced late last year. Spotify offers customers up to 15 hours of audiobook listening a month as part of their paid plan. While the company pays publishers for books, it has so far only collected additional revenue from listeners who exceed the limit.

The Swedish audio company is also going to introduce a new basic tier that will offer music and podcasts — but not audiobooks — for the current $11 monthly price of an individual premium plan, said the people. Users of that plan will need to pay for audiobooks.

The new basic tier is the first of what will be several new pricing options from Spotify. The company has also been working on a “supremium” plan, which would charge customers a higher price for access to high-fidelity audio, among other features, as Bloomberg reported last year.

For years, Spotify offered most customers two options — a free, advertising-supported music service with limited functionality and a paid listening product with unlimited access.

But the company has lost money every year since it went public in 2018, largely because it pays out about 70% of its sales in royalties to the music industry. Spotify paid record labels, artists and others more than $9 billion last year – from $13.2 billion in revenue.

Management has attempted to reduce Spotify’s reliance on the music industry by offering other types of entertainment.

The company dabbled in video before deciding to focus on offering many different kinds of audio. It began by pouring billions of dollars into podcasts, an emerging field of on-demand audio. While management has said podcasts will turn a profit this year, Spotify also fired thousands of employees and curtailed its investment in original audio programming.

Last year, the company announced big plans in audiobooks, a field dominated by Amazon.com Inc.’s Audible. While Audible customers must pay to listen to almost any book, Spotify offered its customers free, limited access. The results so far have been strong, at least in terms of consumption.

Spotify’s move into other kinds of programming has alarmed its partners in the music industry, who fret the company will try to reduce their royalties. As a result, major music companies have been pushing Spotify and its competitors to raise prices.

While Netflix Inc. has doubled the price of its most popular plan in recent years, Spotify only raised prices in major markets last year for the first time since introducing its premium audio service to the US in 2011. Despite concerns that some subscribers would cancel, the company posted its best year of user growth ever, with 113 million new sign-ups to its free and paid services.

Spotify had 602 million users at the end of 2023, including 236 million paying customers.

The success of the price increase has given management confidence to seek even more. Under the new pricing, individual plans will go up by about $1 a month, while family plans and so-called duo plans for couples will rise by $2.

Spotify’s biggest competitors, Apple Inc. and Amazon.com Inc., have also raised prices for their music services.

Music companies and audio services are also discussing ways to generate additional money from the most ardent fans. Currently, all listeners pay the same rate for access to a musician’s catalog. But there are fans willing to pay far more to support an artist they love, as evidenced by the rising price of concert tickets, merchandise and even vinyl for Korean artists.

Among the various options, streaming services have discussed charging people more for early access to new music. Yet the companies are reluctant to significantly alter the main paid product – such as Spotify’s $11-a-month, all-you-can-listen plan. Whether or not management figures out how to capitalize on the more-loyal fans, the cost of that main service is only going up."
"{'id': 'business-insider', 'name': 'Business Insider'}",Alex Bitter,Amazon's Just Walk Out technology relies on hundreds of workers in India watching you shop,Amazon promoted Just Walk Out as AI-powered cashierless technology. But the tech reportedly relied on workers in India for accuracy.,https://www.businessinsider.com/amazons-just-walk-out-actually-1-000-people-in-india-2024-4,https://i.insider.com/660d66df3f923f7dab040be4?width=1200&format=jpeg,2024-04-03 17:10:56+00:00,"By clicking “Sign Up”, you accept our Terms of Service and Privacy Policy . You can opt-out at any time.

Access your favorite topics in a personalized feed while you're on the go. download the app

Sign up to get the inside scoop on today’s biggest stories in markets, tech, and business — delivered daily. Read preview

Amazon's Just Walk Out technology had a secret ingredient: Roughly 1,000 workers in India who review what you pick up, set down, and walk out of its stores with.

The company touted the technology, which allowed customers to bypass traditional checkouts, as an achievement powered entirely by computer vision. But Just Walk Out was still very reliant on humans, The Information reported on Tuesday, citing an unnamed person who has worked on Just Walk Out technology.

This story is available exclusively to Business Insider subscribers. Become an Insider and start reading now.

About 700 of every 1,000 Just Walk Out sales had to be reviewed by Amazon's team in India in 2022, according to The Information. Internally, Amazon wanted just 50 out of every 1,000 sales to get a manual check, according to the report.

Related stories

An Amazon spokesperson disputed that claim in a statement to Business Insider, saying that the team in India mostly helps train the model that the company used for Just Walk Out.

Advertisement

""Associates may also validate a small minority of shopping visits where our computer vision technology cannot determine with complete confidence an individual's purchases,"" the spokesperson said.

The revelation comes as Amazon is planning to replace Just Walk Out at Amazon Fresh stores with its Dash Carts, The Information reported. The smart shopping carts also allow customers to avoid waiting in a checkout line, though they have to place their purchases in the cart, which keeps track of their selections and debits their accounts.

While customers used Just Walk Out at Amazon Fresh stores, ""they also wanted the ability to easily find nearby products and deals, view their receipt as they shop, and know how much money they saved while shopping throughout the store"" — all options that the company's Dash Cart provides, the company spokesperson said of the change.

Just Walk Out first appeared in Amazon Go convenience stores. The technology allowed customers to enter a store by identifying themselves with their Amazon account. From there, they could pick up items, put them back on the shelves, and walk out with their final picks, all without having to interact with a cashier.

Advertisement

In the last few years, Amazon has rolled Just Walk Out to larger-format stores. Twenty-seven of the 44 Amazon Fresh stores currently have the tech. Amazon also added Just Walk Out to some Whole Foods stores.

Startups have also created their own versions of Just Walk Out and tested them at retailers including Aldi and Dollar General.

Do you work for Amazon Fresh or Whole Foods and have a story idea to share? Reach out to this reporter at abitter@businessinsider.com or via encrypted messaging app Signal at 808-854-4501."
"{'id': 'cnn', 'name': 'CNN'}",Ramishah Maruf,Amazon’s cashier-less technology was supposed to revolutionize grocery shopping. It’s been a flop,"When Amazon debuted cashier-less technology, it was hailed as the future of retail. But now, Amazon is walking back its “Just Walk Out” technology at its grocery stores, reining in grand promises of an automated, friction-less checkout.",https://www.cnn.com/2024/04/03/business/amazons-self-checkout-technology-grocery-flop/index.html,"https://media.cnn.com/api/v1/images/stellar/prod/gettyimages-1574692455.jpg?c=16x9&q=w_800,c_fill",2024-04-03 20:35:09+00:00,"New York CNN —

When Amazon debuted cashier-less technology, it was hailed as the future of retail. But now, Amazon is walking back its “Just Walk Out” technology at its grocery stores, reining in grand promises of an automated, friction-less checkout.

Amazon said it is removing the technology at US Amazon Fresh grocery stores which allows customers to pay for their groceries without waiting in line for a cashier or using a self-checkout machine. Instead, Amazon said it’s replacing it with Dash Cart at its more than 40 locations, a “smart shopping cart” which allows shoppers to scan groceries, link to online shopping lists and check out their groceries. The company has been testing Dash Carts at some Fresh and Whole Foods locations in the past.

Customers just haven’t bought into cashier-less technology, especially in grocery stores where they purchase larger quantities and face extra tasks such as weighing produce. Amazon says the checkout technology may be more seamless in smaller stores – that could include the Amazon Go convenience stores.

In a statement, Amazon said it will continue using the Just Walk Out technology in Amazon Go stores, at smaller format Fresh stores in the UK, and third-party locations such as certain sports stadiums and college campuses. Amazon had used roughly 1,000 humans in India, according to some news reports, to help monitor accurate checkouts. The company told CNN it’s “reducing the number of human reviews” while developing the “Just Walk Out” technology. Amazon said besides data associates’ main role in working on the underlying technology, they also “validate a small minority” of shopping visits.

Customers entered Fresh stores using Amazon One palm recognition, the app or a credit or debit card. Amazon said “sensors, cameras, and deep learning tools” caught what customers took off the shelf, automatically charging them.

Amazon says it is also installing self-checkout kiosks and assisted checkout options at Fresh locations once they’ve transitioned to using Dash Cart.

Retailers from Dollar General to Walmart and Costco are rethinking the reliance on self-checkout, as they find it leads to higher merchandise losses from customer mistakes and shoplifting.

Amazon Fresh struggles

The tech giant opened its first Amazon Fresh store in 2020, and has more than 40 locations across the US. After Amazon bought Whole Foods in 2017, it added cashier-less checkout in those stores as well.

In 2021, Amazon eliminated checkout lines in a full-sized, 25,000-square-foot Amazon fresh store in Washington state, and announced it was ramping up openings of the stores. But Amazon Fresh has faced setbacks since it debuted, including challenges getting shoppers to buy groceries in its Amazon Fresh grocery stores, and it laid off workers.

Starting in 2023, the company said it was pausing Amazon Fresh store expansions.

“We’re doing a fair bit of experimentation today in those stores to try to find a format that we think resonates with customers,” Amazon CEO Andy Jassy said in February 2023. “We’ve decided over the last year or so that we’re not going to expand the physical Fresh [stores] until we have that equation.”

In response, Amazon has redesigned Fresh stores in Chicago and Southern California. For example, in two Chicago-area locations in 2023, Amazon added hundreds of new name brands, more quick meal options, self-checkout kiosks and the Dash carts.

CNN’s Nathaniel Meyersohn and Moira Ritter contributed to this report."
"{'id': 'business-insider', 'name': 'Business Insider'}",Jyoti Mann,Amazon-backed humanoid firm Agility Robotics laid off a 'small number' of staff,"Workers affected by the job cuts ""were not central to core product development and commercialization,"" an Agility Robotics spokesperson said.",https://www.businessinsider.com/agility-robotics-laid-off-employees-amazon-2024-4,https://i.insider.com/660e7f303f923f7dab047c46?width=1200&format=jpeg,2024-04-04 10:43:29+00:00,"Agility Robotics said it laid off a ""small number"" of employees on Wednesday.

Amazon, which has invested in the company, is testing its robot in a research facility.

Agility plans to open a new factory in Oregon later this year to mass-produce its Digit robot.

NEW LOOK Sign up to get the inside scoop on today’s biggest stories in markets, tech, and business — delivered daily. Read preview Thanks for signing up! Access your favorite topics in a personalized feed while you're on the go. download the app Email address Sign up By clicking “Sign Up”, you accept our Terms of Service and Privacy Policy . You can opt-out at any time.

Advertisement

Agility Robotics reduced the size of its workforce on Wednesday.

The company told Business Insider that the job cuts affected a ""small number"" of employees.

""As part of Agility's ongoing efforts to structure the company for success, we have parted ways with a small number of employees that were not central to core product development and commercialization,"" a spokesperson said.

Amazon is testing its Agility's Digit robots in a research and development facility near Seattle. The tech giant has previously funded Agility as part of its first round of investments through its $1 billion Amazon Industrial Innovation Fund.

Advertisement

An electrical engineer at the humanoid robotics firm shared in posts on LinkedIn and X that he was ""one of the many laid off"" at the company.

He added that he was ""surprised at the timing"" because he'd only just been moved from the support engineering team to the electrical engineering team last year.

Related stories

Chief people officer Lisa Haugh commented on the LinkedIn post, saying she was ""sorry"" that he was ""a part of the small group impacted"" by the layoffs. It's not clear exactly how many employees Agility has or how many jobs were cut.

The job cuts underline the difficulty some robotics firms have with funding their activities even with the backing of tech giants, as Crunchbase has reported.

Advertisement

Agility also told BI that along with cutting jobs, it's also focused on meeting the ""extraordinary demand for bipedal robots across industrial use cases.""

""That means ramping up production of Digit while continuing to win top-tier global customers, and adding new roles that meet these goals. We believe today's actions will allow us to focus on the areas that drive productization, commercialization, and production of Digit.""

The two-legged Digit can lift and move items in warehouses and distribution centers.

The company announced last month that it appointed a new CEO, Peggy Johnson, as it prepares to open a factory in Oregon later this year to start mass-producing robots.

Advertisement

Johnson previously told BI that it will churn out ""hundreds"" of its Digit robots in 2025 and then ""ramp up capacity to thousands"" in the years that follow.

It's been touted by the firm as a way to potentially help ease the labor shortage in the manufacturing industry, as data from the Bureau of Labor Statistics projected there will be about one million openings for laborers and material movers over the next decade."
