source,author,title,description,url,urlToImage,publishedAt,content
"{'id': 'newsweek', 'name': 'Newsweek'}",James Crawford-Smith,Meghan Markle Nemesis Primed For TV Return,"Jeremy Clarkson will be back on screen with a new season of his Amazon Prime show, despite a media backlash over Meghan.",https://www.newsweek.com/meghan-markle-nemesis-jeremy-clarkson-tv-return-1888288,https://d.newsweek.com/en/full/2375256/meghan-markle.png,2024-04-09 09:12:37+00:00,"British TV host and journalist Jeremy Clarkson is set to bring back his hit farming docuseries next month, despite a U.K. press organization ruling that he made ""pejorative and prejudicial"" comments about Meghan Markle's sex.

Clarkson's Farm will return to Amazon Prime for its third season, streaming from May 3. This comes after the show faced calls for cancelation after its star's controversial comments about Meghan.

Clarkson received international backlash against his December 16, 2022, column for The Sun newspaper titled ""One day, Harold the glove puppet will tell the truth about A Woman Talking B*****ks,"" in which he expressed hatred for Meghan and a desire to see her paraded naked through the streets and shamed.

""I hate her. Not like I hate [former First Minister of Scotland] Nicola Sturgeon or [convicted serial killer] Rose West. I hate her on a cellular level,"" he wrote.

""At night, I'm unable to sleep as I lie there, grinding my teeth and dreaming of the day when she is made to parade naked through the streets of every town in Britain while the crowds chant, 'Shame!' and throw lumps of excrement at her.""

The column received swift backlash from social media users and was removed from The Sun's website shortly after. However, it still appeared in the print edition of the paper.

The Duchess of Sussex in Austin, Texas, March 8, 2024. TV star Jeremy Clarkson who published derogatory comments about Meghan in 2022 will see his Amazon Prime show return on May 3. The Duchess of Sussex in Austin, Texas, March 8, 2024. TV star Jeremy Clarkson who published derogatory comments about Meghan in 2022 will see his Amazon Prime show return on May 3. Astrida Valigorsky/Getty Images

Over 25,000 complaints about Clarkson's comments were received by Britain's Independent Press Standards Organization (IPSO), the regulatory body for the newspaper and magazine industry in the U.K.

IPSO opened a lengthy investigation into the comments and column in February 2023. After four months they returned a ruling that in publishing Clarkson's commentary, The Sun had breached Clause 12 of the Editors' Code of Practice which deals with discrimination.

On June 30, 2023, IPSO chair Lord Faulks said in a statement: ""This was a serious breach of the Editors' Code of Practice. We ruled that in this article The Sun published a pejorative and prejudicial reference to the Duchess of Sussex's sex and breached Clause 12 (Discrimination) of the Editors' Code of Practice.""

""We found that the imagery employed by the columnist in this article was humiliating and degrading toward the Duchess.""

Clarkson addressed the column in two public statements prior to the ruling. Two days after its publication, he wrote on X (formerly Twitter) that he was ""horrified to have caused so much hurt"" and that his naked and shaming analogy was intended as a reference to the HBO show Game of Thrones.

The star then issued a longer statement on social media apologizing and explaining that he had sent a personal apology to Harry and Meghan via email. This, however, was disputed by representatives for the duke and duchess who said an email was received but was only addressed to Harry and was marked ""private and confidential.""

The Duchess of Sussex (L) in Windsor, September 10, 2022. Jeremy Clarkson (R) in London, August 30, 2022. Clarkson's 2022 column for ""The Sun"" newspaper in which he referenced Meghan was investigated by IPSO. The Duchess of Sussex (L) in Windsor, September 10, 2022. Jeremy Clarkson (R) in London, August 30, 2022. Clarkson's 2022 column for ""The Sun"" newspaper in which he referenced Meghan was investigated by IPSO. Chris Jackson/Getty Images/Nick England/Getty Images

After the IPSO ruling, attention once again turned to Amazon Prime Video who produce Clarkson's Farm and The Grand Tour shows on which the presenter appears.

During an appearance at the Edinburgh TV Festival in August 2023, bosses for Prime Video revealed that its relationship with Clarkson was now complicated.

""There are lots of discussions going on, but the thing that's important to say is there is so much more going on to the show than Clarkson,"" Head of U.K. Unscripted, Fozia Khan, told the festival audience about the farming show, per Deadline.

U.K. Head of Originals Dan Grabiner added: ""No decisions have been made... It's a very complex topic, but we are not interrupting production of the current season.""

""I can't tell you what a phenomenon this show is and the impact it's had on the agricultural community,"" Grabiner said. ""We get messages from farmers around the world who just love the show, saying they've never really seen their world reflected properly on screen before. It's a hell of a lot bigger than Jeremy Clarkson.""

The executives did not confirm whether their relationship with Clarkson would change after the production and release of season 3.

Newsweek approached representatives of Amazon Prime Video and Meghan Markle via email for comment.

James Crawford-Smith is Newsweek's royal reporter, based in London. You can find him on X (formerly Twitter) at @jrcrawfordsmith and read his stories on Newsweek's The Royals Facebook page.

Do you have a question about King Charles III, William and Kate, Meghan and Harry, or their family that you would like our experienced royal correspondents to answer? Email royals@newsweek.com. We'd love to hear from you."
"{'id': 'business-insider', 'name': 'Business Insider'}",Ana Altchek,Google just unveiled a new weapon against Microsoft and Amazon in the AI arms race,"Google is partnering with Arm to make more of its own chips, its latest move forward in the race to scale up in AI.",https://www.businessinsider.com/google-ramped-up-ai-competition-against-microsoft-amazon-2024-4,https://i.insider.com/66154e1e1caec1275a6e1454?width=1200&format=jpeg,2024-04-09 21:04:51+00:00,"Google has announced the development of its own Arm-based CPU processor, Axion.

The move gives Google an edge in its competition with Amazon and Microsoft in the AI cloud race.

Google says Axion will deliver better performance and energy efficiency than prior chips.

NEW LOOK Sign up to get the inside scoop on today’s biggest stories in markets, tech, and business — delivered daily. Read preview Thanks for signing up! Access your favorite topics in a personalized feed while you're on the go. download the app Email address Sign up By clicking “Sign Up”, you accept our Terms of Service and Privacy Policy . You can opt-out at any time.

Advertisement

Google has a new edge against competitors such as Amazon and Microsoft: It's partnering with Arm to make more of its own chips.

Google announced its new CPU, named Axion, on Tuesday. It's following Amazon Web Services and Microsoft Azure in creating custom Arm-based processors.

The move is another step forward in Google's development of new computing resources. Axion is set to be available for Cloud services later this year. Google says Axion will improve performance for ""general-purpose workloads,"" such as open-source databases, web and app servers, in-memory caches, data-analytics engines, media processing, and artificial-intelligence training.

This story is available exclusively to Business Insider subscribers. Become an Insider and start reading now. Have an account? Log in ."
"{'id': 'fortune', 'name': 'Fortune'}","Anna J. Kaiser, Mark Gurman, Bloomberg","Apple joins tech exodus to Florida— iPhone maker plans a 45,000 square foot office near Miami",The company joins other tech firms including Amazon and Microsoft in venturing south.,https://fortune.com/2024/04/09/apple-florida-iphone-office-miami/,"https://fortune.com/img-assets/wp-content/uploads/2024/04/GettyImages-2077025425-e1712703595479.jpg?resize=1200,600",2024-04-10 00:16:40+00:00,"Apple Inc. is upgrading its presence in the Miami area, following other Big Tech companies in setting up outposts or expanding in South Florida.

Apple is taking 45,000 square feet (4,181 square meters) in a new building in Coral Gables, a wealthy suburb just south of Miami, according to people familiar with the matter, who asked not to be identified because the plans are private.

Apple declined to comment.

The company already has a smaller office in the vicinity, which has focused mostly on Latin America as well as the advertising business, including selling ad slots in the App Store. The firm is also expected to open a large new retail store location at the $4 billion Worldcenter development in Miami.

South Florida has been a magnet for the ultra-wealthy and their companies since the pandemic upended the U.S. economy, with firms either outright moving to the area or expanding their footprints. Amazon.com Inc. is looking for roughly 50,000 square feet in Miami, after founder Jeff Bezos moved to Florida from Seattle. Microsoft Corp. has also leased a new office in the city, in the same building that will serve as headquarters for Ken Griffin’s Citadel.

Apple’s new Miami space will be at The Plaza Coral Gables, a project bankrolled by Agave Holdings, a Mexican family office powered by tequila money. Raymond James has also set up shop in the building.

The increased demand for office space has led to sharp increase in rents. Asking rates on commercial properties in Miami are now close to $57 a square foot, according to commercial real estate adviser Avison Young."
"{'id': 'business-insider', 'name': 'Business Insider'}",Natalie Musumeci,Amazon and Walmart warehouse employees are so surveilled that they're worried about breaking to use bathroom: Oxfam report,"One Amazon worker quoted in Oxfam's new report likened their experiences on the warehouse floor to ""slavery.""",https://www.businessinsider.com/amazon-walmart-warehouse-surveillance-employees-oxfam-report-2024-4,https://i.insider.com/661053ed1caec1275a6d69cc?width=1200&format=jpeg,2024-04-10 04:03:01+00:00,"Amazon and Walmart use excessive surveillance in their warehouses, a report from Oxfam found.

Oxfam said ""concerning"" practices put warehouse employees' health and well-being in jeopardy.

""Excessive surveillance"" is bad for workers and erodes their rights, the report said.

NEW LOOK Sign up to get the inside scoop on today’s biggest stories in markets, tech, and business — delivered daily. Read preview Thanks for signing up! Access your favorite topics in a personalized feed while you're on the go. download the app Email address Sign up By clicking “Sign Up”, you accept our Terms of Service and Privacy Policy . You can opt-out at any time.

Advertisement

Amazon and Walmart both use over-the-top surveillance in their warehouses — and the ""concerning"" practice not only undermines the rights of these megacorporations' employees but also puts their health and well-being in jeopardy, Oxfam, an international antipoverty organization, said in a report released Wednesday.

The 52-page report, ""At Work and Under Watch: Surveillance and Suffering at Amazon and Walmart Warehouses,"" highlights survey data collected from 1,484 Amazon and 444 Walmart warehouse workers across the United States.

Amazon has 750,000 operations employees working in warehouses throughout the country, the company said. Walmart employs roughly 1.6 million associates in the US, according to a recent SEC filing. Tens of thousands of those workers are employed across Walmart's 200-plus US distribution centers.

Oxfam's report quotes several unidentified warehouse workers for the retail giants describing harsh labor conditions, including one Amazon worker who likened their experiences on the warehouse floor to ""slavery.""

Advertisement

""Amazon has been a pioneer in the area of worker surveillance and management in its warehouses, and Walmart, long known for adopting repressive practices to monitor workers, is also entering a new phase of accelerated technology deployment across its facilities,"" the report says.

Data from two recent surveys, funded in part by Oxfam — the National Survey of Amazon Warehouse Workers and the National Survey of Walmart Warehouse Workers — is included in the report. A substantial amount of Amazon and Walmart warehouse employees who were surveyed reported being closely watched by technology while in the workplace.

""As the data shows, although key differences exist, workers at both Amazon and Walmart are experiencing concerning levels of surveillance,"" the report says. ""Crucially, excessive surveillance is not simply disconcerting for workers; it also erodes worker rights.""

Packages transported on a conveyor belt at an Amazon warehouse on Prime Day. Soren Larson/Reuters

Amazon and Walmart slammed Oxfam's report

Amazon has disputed claims that it uses technology to monitor its warehouse workers, while Walmart said the report fails to accurately depict the company's use of technology.

Advertisement

""While we respect Oxfam and its mission, we have strong disagreements with the characterizations and conclusions made throughout this paper — many based on flawed methodology and hyperbolic anecdotes,"" Maureen Lynch Vogel, an Amazon spokesperson, told Business Insider in a statement. ""In reality, Amazon has made notable safety gains and enriched the communities in which we operate, providing safe, good paying jobs with health benefits and educational opportunities.""

Vogel went on to attack the research itself.

""Traditionally, researchers work to disprove pre-existing beliefs and biases, but the organizations involved in this paper did the opposite — they started with biases and sought to prove them — which is disappointing,"" Vogel said. ""We're not perfect, but we're making measurable progress and our employees' health, safety, and well-being will always be our top priority.""

A Walmart spokesperson told BI in a statement: ""Oxfam's claims are based on incomplete and misleading information. This report inaccurately represents Walmart's use of technology and Walmart's publicly available disclosures around data privacy and worker safety.""

Advertisement

Some 77% of Amazon and 62% of Walmart warehouse employees who participated in the Oxfam report said technology can ""tell"" if they're ""actively engaged in their work"" almost all or most of the time.

Similarly, 72% of Amazon and 67% of Walmart warehouse employees who were surveyed reported that ""how fast"" they work is measured by company technology always or most of the time.

In a seven-page response to Oxfam viewed by BI, Tessie Petion, the head of ESG engagement at Amazon, wrote that the organization's report ""illustrates a misunderstanding of what the technology in our facilities does and doesn't do.""

Related stories

""We do use technology in our facilities to help ensure the safety and security of our employees — it would be irresponsible if we did not take this approach. We also secure our inventory. Our facilities house hundreds of thousands of products that will be shipped to customers around the world, and the technology in our facilities helps guide the flow of goods through the sites,"" Petion wrote.

Advertisement

Petion continued: ""This is similar to technology used throughout the industry. We do not use the camera technology in our warehouses to monitor employees. Employees who have questions about how our technology works, or concerns about the data it collects, are always encouraged to speak to their manager who can explain it to them in greater detail.""

Inside a Walmart warehouse. Suzanne Kreiter/The Boston Globe via Getty Images

More than half of Amazon and Walmart employees said they've found it tough to make time to use the bathroom

Roughly three-quarters of both Amazon and Walmart warehouse workers surveyed by Oxfam reported feeling pressure to work faster at least some of the time.

""Being monitored this minutely takes a physical and mental toll as workers need to make decisions about taking breaks, eating, going to the bathroom, or even drinking water with their pace or performance metrics in mind,"" the report says.

Some 54% of Amazon and 57% of Walmart respondents said their production rate makes it difficult for them to use the bathroom at least some of the time.

Advertisement

""The conditions there are absolutely horrific,"" one Amazon warehouse worker in Alabama was quoted as saying in the report. ""I likened it to slavery because they care more about quotas and meeting production rates than actually caring about us as human beings inside there. I feel more like a number.""

Petion, in her response to Oxfam, called the assertion that workers don't get sufficient breaks ""wrong.""

""In addition to their regularly scheduled breaks, employees are free to take informal breaks throughout their shifts to use the restroom, get water, or talk to a manager or HR,"" she wrote. ""If there's ever a concern about a manager misusing productivity guidance or asking employees to prioritize productivity over safety, we immediately investigate and take appropriate action.""

The data indicates a move toward a 'really dystopian workplace,' an Oxfam director said

Irit Tamir, a senior director of Oxfam America's private-sector department, told BI that the research outlined in the report shows a move toward a ""really dystopian workplace where people feel like they're constantly being monitored and watched.""

Advertisement

""They are feeling oppressed by this cognitive tax on workers who fear this constant surveillance and punishment"" for taking breaks, Tamir said. ""And as a result, you know, I think these warehouse floors have become incubators of injury sustained by automation and surveillance, and workplace cultures of intimidation.""

The Oxfam report said that at Amazon, warehouse workers ""are assigned handheld devices or scanners that record, count, and measure every item they move during their day.""

""These systems measure down to the second the amount of time a worker spends not actively sorting, packing, or performing work — what is called 'time off task,'"" the report said. Those scanners ""play a key role in the surveillance machine,"" the report added, because they can lead to automated penalties for workers who fail to meet production targets.

""In addition, hundreds of security cameras are constantly monitoring the warehouse floor, ready to notify a manager when a worker is away from their station for too long,"" the report said.

Advertisement

Oxfam's report said ""little is known"" about the technology Walmart uses in its warehouses. corporate.walmart.com

When it comes to Walmart, the report said that ""little is known about the technology the company is currently using to monitor workers across its warehouses,"" though Walmart workers surveyed reported being ""watched constantly.""

The report said that the data from the Walmart warehouse-worker survey is the ""first of its kind to offer insights into the extent of worker monitoring at Walmart's warehousing facilities, and it captures vital information about the company's current practices.""

One Walmart worker quoted in the Oxfam report said the company's warehouse robots ""are treated better than human beings.""

Abby Maxman, the president and CEO of Oxfam America, said in a statement that Amazon and Walmart make ""record profits on the backs of warehouse workers by exploiting them through oppressive surveillance practices.""

Advertisement

Oxfam wants both Walmart and Amazon to commit to ""ceasing or significantly reforming their use of worker surveillance technologies to enforce unreasonable and/or unsafe quotas.""

""These are the two biggest private employers in the United States,"" Tamir told BI. ""So we are talking impact across millions of workers."""
"{'id': 'financial-post', 'name': 'Financial Post'}",The Canadian Press,Unifor applies to represent two Amazon fulfilment centres in Metro Vancouver,VANCOUVER — Unifor has filed two applications to represent Vancouver-area Amazon workers with the B.C. Labour Relations Board. The union said in a press release Wednesday that it has filed applications for an Amazon fulfilment centre in New Westminster and on…,https://financialpost.com/pmn/business-pmn/unifor-applies-to-represent-two-amazon-fulfilment-centres-in-metro-vancouver,https://smartcdn.gprod.postmedia.digital/financialpost/wp-content/uploads/2024/04/nydd202-the-associated-press.jpg,2024-04-10 22:08:56+00:00,"The union announced last week it had filed two applications with the B.C. Labour Relations Board to represent workers at fulfilment centres in New Westminster and Delta.

We apologize, but this video has failed to load.

VANCOUVER — Unifor says it’s temporarily withdrawing its applications to represent workers at two Vancouver-area Amazon facilities, accusing the e-commerce giant of providing a “suspiciously high” employee count.

This advertisement has not loaded yet, but your article continues below.

Create an account or sign in to continue with your reading experience.

Subscribe now to read the latest news in your city and across Canada.

Subscribe now to read the latest news in your city and across Canada.

THIS CONTENT IS RESERVED FOR SUBSCRIBERS ONLY

Article content

“We’re not going anywhere. Unifor is committed to the hundreds of workers at Amazon who have signed a confidential union card and will re-double our efforts in the coming weeks,” said Unifor western regional director Gavin McGarrigle in the press release.

Unifor says B.C. law doesn’t make employers provide an employee count during a union drive, meaning unions have to guess how many signed cards they need before applying for certification.

If the signed cards represent more than 55 per cent of the eligible workforce at a facility, union certification is granted, while if the cards represent at least 45 per cent, a vote may be called instead, the law says.

Amazon spokesperson Barbara Agrait said the company is confident it provided the board with accurate and complete information.

The union said it plans to re-apply to the labour board.

“Make no mistake: workers at Amazon in Metro Vancouver are closer than ever to successfully forming a union,” said McGarrigle.

Unifor said it has repeatedly called for changes to the B.C. Labour Relations Code to improve employer transparency during the unionization process.

“When working people are up against giant, well-funded multinational employers, we need more tools to help level the playing field,” McGarrigle said in the release.

The union first announced a union drive for Amazon workers in Metro Vancouver last July, and said workers began signing cards in October.

When Unifor announced its applications last week, Agrait said Amazon looks forward to working with employees to “continue making Amazon a great place to work.”

This report by The Canadian Press was first published April 16, 2024."
